title,content,published_at,media_name,url,keyword
중국 지방양회 발표 보니…올해 성장률 목표치 ‘5% 이상’ 될 듯,"31개 성·시 지방단위 목표치 공개
[서울경제]
인민대표대회·정치협상회의 등 올해 ‘지방양회’가 중국 전역에서 마무리되고 가장 관심을 끌었던 올해 국내총생산(GDP) 성장 목표치는 모두 5% 이상으로 잡은 것으로 나타났다.
13일 홍콩 명보 등 중화권 매체에 따르면 전날 톈진을 마지막으로 중국 내 31개 성·자치구·직할시가 해당 지방양회를 개최하고 올해 성장률 목표치를 발표했다. 톈진은 코로나19 확산으로 양회가 다소 늦게 개최됐다.
이들을 종합하면 31개 성급 지방정부는 모두 올해 성장률 목표치를 5% 이상으로 설정했다. 가장 목표치를 낮게 잡은 곳은 톈진시와 베이징시로 나란히 ‘5% 이상’으로 설정했다. 반대로 면세점 특수를 누리는 하이난성은 목표치를 가장 높은 ‘9%’로 잡았다.
GDP 규모에서 중국 내 1~3위 지역인 광둥성, 장쑤성, 산둥성은 각각 ‘5.5%‘ ‘5.5% 이상’ ‘5.5% 이상’으로 목표치를 잡았다. 중국의 경제중심지인 상하이시도 ‘5.5%’를 설정했다.
세부적으로는 하이난성을 포함해 9개 지방 정부가 ‘7% 이상’으로, 산시성(산서성) 등 12개 지역은 ‘6% 이상∼7% 미만’으로, 베이징시와 톈진시를 포함해 10개 지역은 ‘5∼5.5% 이상’이라고 밝혔다.
지난해 광둥성의 실제 성장률이 8%, 장쑤성은 8.6%, 산둥성이 8.3%였던 것을 감안하면 올해 목표치는 3%포인트 내외가 줄어든 것이다. 이에 따라 오는 3월 베이징에서 열리는 전국양회에서 공개될 올해 전체 성장률 목표치가 ‘5% 이상’이 될 가능성이 커졌다. 중국은 지난해 8.1% 성장했었다. 중앙정부는 지방정부들의 목표치를 토대로 올해 성장률 목표치를 제시한다.
앞서 중국 국무원 싱크탱크 사회과학원은 올해 경제 성장률을 5.3%가량으로 예측하면서 약간의 여지를 두기 위해 ‘5% 이상’의 목표를 설정하라고 정책 당국에 공개 건의한 바 있다.
중국 공산당 정부는 지난해 12월 열린 중앙경제공작회의에서 자국 경제가 수요 축소, 공급 충격, 경제성장 기대치 약화라는 ‘3중 압력’에 직면했다고 진단하고 ‘안정’을 최우선 목표로 올해 경제를 운용하겠다는 방향을 제시했었다.
/최수문기자 chsm@sedaily.com",2022-02-13 17:13:02,서울경제,https://n.news.naver.com/mnews/article/011/0004018165?sid=104,GDP 성장률
"""한국, 올해 성장률 2.1% 예상…기준금리 추가 인상 없을수도""","세계경제연구원 웨비나서 해외 전문가 전망
(서울=연합뉴스) 김유아 기자 = 올해 우리나라의 경제 성장률이 수출 증가 둔화와 내수 부진 등으로 시장의 예상보다 낮은 2.1%를 기록하는 데 그칠 것이라는 분석이 제기됐다.
로버트 슈바라만 노무라 그룹 아시아경제·글로벌시장분석 책임자는 18일 세계경제연구원이 개최한 '2022 한국 및 중국 경제·금융시장 전망: 포스트 팬데믹 세계경제의 구조적 변화' 웨비나에 연사로 나서 이같이 밝혔다.
주요 기관은 우리나라의 올해 국내총생산(GDP) 성장률을 3% 정도로 보고 있는데, 이보다 낮을 것이라는 예상이다.
이런 저성장 때문에 한국은행은 연내 기준금리를 추가로 인상하지 않고 1.25% 수준을 유지할 것으로도 봤다.
한은이 기준금리를 연내 2∼4차례, 최고 1.75%까지 인상할 수 있을 것으로 보고 있는 시장 분위기와 비교된다.
그는 이런 전망을 한 배경으로 중국 경제의 성장 둔화를 꼽았다. 중국의 성장세가 느려지면 우리나라의 수출 증가세도 주춤할 것이라는 분석이다.
또 국내 가계부채 급증에 따라 당국이 대출을 옥죄고 나서면서 민간소비가 부진해질 수 있다는 점과 내달 대선 결과에 따른 불확실성 증대도 한국경제의 하방 요인으로 꼽았다.
중국경제에 대해서는 ""작년 실제 성장률은, 4%로 나온 공식 집계보다 더 낮을 것으로 추정된다""라면서 ""올해는 성장 둔화가 더 본격화할 수 있다""라고 내다봤다.
특히 '제로 코로나' 정책으로 인한 비용 상승, 부동산 시장 규제, 지방정부의 대규모 부채 등이 1분기 중국의 경제 위축을 초래하고 있다면서 ""대외무역 부문만이 유일하게 중국 경제의 명목 성장을 견인할 것""이라고 진단했다.
이런 예상에 따라 중국은 주요국과는 반대로 금리 인하 등 완화적인 통화정책을 상당 기간 이어가고, 재정부양을 위한 정부의 지출도 많이 늘릴 것이라는 게 그의 시각이다.
세계 경제에 대해서는 올해 코로나19 팬데믹이 종식 단계에 진입하겠지만, 소득불평등 가속화, 잠재성장률 하락 등 충격 여파가 지속할 것으로 봤다.
kua@yna.co.kr",2022-02-18 10:01:13,연합뉴스,https://n.news.naver.com/mnews/article/001/0012996438?sid=101,GDP 성장률
"""올해 한국 성장률 2.1% · 기준금리 1.25% 머물 가능성""","올해 우리나라의 경제 성장률이 수출 증가 둔화와 내수 부진 등으로 시장의 예상보다 훨씬 낮은 2.1%를 기록하는 데 그칠 것이라는 분석이 제기됐습니다.
로버트 슈바라만 노무라 그룹 아시아경제·글로벌시장분석 책임자는 오늘(18일) 세계경제연구원이 개최한 '2022 한국 및 중국 경제·금융시장 전망: 포스트 팬데믹 세계경제의 구조적 변화' 웨비나에 연사로 나서 이같이 밝혔습니다.
국제통화기금(IMF)과 한국은행 등 주요 기관들은 우리나라의 올해 국내총생산(GDP) 성장률을 3.0% 정도로 보고 있는데, 이보다 낮을 것이라는 예상입니다.
이런 저성장 때문에 한은은 연내 기준금리를 추가로 인상하지 않고 1.25% 수준을 유지할 것으로도 봤습니다.
한은이 기준금리를 연내 2∼4차례, 최고 1.75%까지 인상할 수 있을 것으로 보고 있는 시장 분위기와 비교됩니다.
그는 이런 전망을 한 배경으로 중국 경제의 성장 둔화를 지목했습니다.
중국의 성장세가 느려지면 우리나라의 수출 증가세도 주춤할 것이라는 분석입니다.
또 국내 가계부채 급증에 따라 당국이 대출을 옥죄고 나서면서 민간소비가 부진해질 수 있다는 점과 내달 대선 결과에 따른 불확실성 증대도 한국경제의 하방 요인으로 꼽았습니다.
중국경제에 대해서는 ""작년 실제 성장률은, 4%로 나온 공식 집계보다 더 낮을 것으로 추정된다""라면서 ""올해는 성장 둔화가 더 본격화할 수 있다""라고 내다봤습니다.
특히 '제로 코로나' 정책으로 인한 비용 상승, 부동산 시장 규제, 지방정부의 대규모 부채 등이 1분기 중국의 경제 위축을 초래하고 있다면서 ""대외무역 부문만이 유일하게 중국 경제의 명목 성장을 견인할 것""이라고 진단했습니다.
이런 예상에 따라 중국은 주요국과는 반대로 금리 인하 등 완화적인 통화정책을 상당 기간 이어가고, 재정부양을 위한 정부의 지출도 많이 늘릴 것이라는 게 그의 시각입니다.",2022-02-18 10:49:02,SBS,https://n.news.naver.com/mnews/article/055/0000954660?sid=101,GDP 성장률
"""올해 성장률 2%대 그칠 수도…기준금리 추가 인상 없을 것""","올해 우리나라의 경제 성장률이 시장의 예상보다 낮은 2%대 초반을 기록하는 데 그칠 것이라는 분석이 제기됐다.
로버트 슈바라만 노무라 그룹 아시아경제·글로벌시장분석 책임자는 18일 세계경제연구원이 개최한 '2022 한국 및 중국 경제·금융시장 전망: 포스트 팬데믹 세계경제의 구조적 변화' 웨비나에 연사로 나서 이같이 밝혔다.
주요 기관은 우리나라의 올해 국내총생산(GDP) 성장률을 3% 정도로 보고 있는데, 이보다 낮을 것이라는 예상이다.
이런 저성장 때문에 한국은행은 연내 기준금리를 추가로 인상하지 않고 1.25% 수준을 유지할 것으로도 봤다.
한은이 기준금리를 연내 2∼4차례, 최고 1.75%까지 인상할 수 있을 것으로 보고 있는 시장 분위기와 비교된다.
그는 이런 전망을 한 배경으로 중국 경제의 성장 둔화를 꼽았다. 중국의 성장세가 느려지면 우리나라의 수출 증가세도 주춤할 것이라는 분석이다.
또 국내 가계부채 급증에 따라 당국이 대출을 옥죄고 나서면서 민간소비가 부진해질 수 있다는 점과 내달 대선 결과에 따른 불확실성 증대도 한국경제의 하방 요인으로 꼽았다.
중국경제에 대해서는 ""작년 실제 성장률은, 4%로 나온 공식 집계보다 더 낮을 것으로 추정된다""라면서 ""올해는 성장 둔화가 더 본격화할 수 있다""라고 내다봤다.
특히 '제로 코로나' 정책으로 인한 비용 상승, 부동산 시장 규제, 지방정부의 대규모 부채 등이 1분기 중국의 경제 위축을 초래하고 있다면서 ""대외무역 부문만이 유일하게 중국 경제의 명목 성장을 견인할 것""이라고 진단했다.
이런 예상에 따라 중국은 주요국과는 반대로 금리 인하 등 완화적인 통화정책을 상당 기간 이어가고, 재정부양을 위한 정부의 지출도 많이 늘릴 것이라는 게 그의 시각이다.
세계 경제에 대해서는 올해 코로나19 팬데믹이 종식 단계에 진입하겠지만, 소득불평등 가속화, 잠재성장률 하락 등 충격 여파가 지속할 것으로 봤다.
(사진=연합뉴스)",2022-02-18 10:11:30,한국경제TV,https://n.news.naver.com/mnews/article/215/0001015414?sid=101,GDP 성장률
“낡은 GDP…삶의 질 담는 ‘한국형 성장지표’ 필요”,"참성장·행복 지표 도입 토론회
GDP엔 행복·평화·안전 등 빠져
환경·공동체·디지털 서비스 등
다양한 가치 담을 새 지표 소개
‘참성장지표’ 기준으로 본 한국
GDP 성장률 뛰어넘는 발전 보여
“새 발전지표, 경제 전환 잣대로”
정부가 경제성장 측정지표로 삼아온 국내총생산(GDP)을 대체할 새로운 발전지표가 필요하다는 주장이 제기됐다. 환경과 삶의 질, 디지털 가치를 담은 새 지표로 정부의 성과를 평가하고 그간 GDP가 이끌어온 양적 성장 모델에서 벗어나자는 취지다.
민간독립연구소 LAB2050은 국민총행복전환포럼과 김영배 더불어민주당 의원, 장혜영 정의당 의원, 조정훈 시대전환 의원과 공동으로 16일 국회에서 ‘GDP는 낡았다: 지속 가능성과 삶의 질 향상을 위한 참성장·행복 지표 도입 방안’ 토론회를 열었다.
GDP는 1930년대 경제대공황 시기에 ‘효용(행복)은 경제성장(소득 증가)을 통해 얻을 수 있다’는 아이디어에서 출발해 국가의 경제성장을 측정하는 지표로 사용돼 왔다. 그러나 개인이 느끼는 행복, 평화, 안전 등의 가치가 GDP 계산에서 배제되면서 GDP 수치와 사람들이 실제 느끼는 효용(행복) 간에 간격이 생기기 시작했다. 소득이 늘어도 삶의 질은 나아지지 않는다는 인식이 확산되면서 ‘행복지표’로서 GDP가 더 이상 유효하지 않다는 주장도 힘을 얻고 있다.
김석호 서울대 사회학과 교수는 “기존의 발전이 경제적으로 낙후한 현실을 개선해 더 풍요로운 현재를 만드는 것이었다면 최근 발전 개념은 당장 경제적 관점에서 이득을 극대화하지 못하더라도 먼 미래에는 더 큰 이익이 될 수 있도록 방향을 설정하는 것”이라고 진단했다.
이날 토론회에서는 GDP의 대안으로 쓸 새로운 한국형 성장지표가 제시됐다. 손종칠 한국외국어대 경제학부 교수는 ‘참성장지표’를 소개했다. 경제뿐 아니라 환경, 공동체, 인적 자본, 디지털 서비스의 가치를 화폐화해 반영한 지표다. 시장 재화와 서비스를 중심으로 구성된 GDP와 달리 삶의 질에 영향을 주지만 시장에서는 거래되지 않는 다양한 가치를 담고 있다. 최근 국제사회에서 GDP 대안으로 거론되는 GPI(Genuine Progress Indicator)에 한국 사회의 특수성과 환경 변화를 반영했다고 그는 설명했다.
참성장지표 기준으로 보면 한국 사회의 발전 수준은 GDP 성장률을 뛰어넘는다. 예컨대 2011~2020년 GDP는 연평균 2.53% 성장한 반면 참성장지표는 연평균 3.65% 증가했다. 공공서비스 확충과 기초연금 도입, 최저임금 향상, 노동정책 발전으로 인한 불평등 감소 등이 반영된 결과다. 손 교수는 “우리나라가 성숙한 선진국으로 도약하려면 사회환경적 가치를 반영한 참성장지표가 필요하다”며 “먼저 광역시·도 차원에서 지표 구축 시범사업을 실시해야 한다”고 제안했다.
박양수 한국은행 경제연구원장은 “참성장지표에서 부문 간 가중치 등은 지속적으로 개선해가야 한다”면서도 “참성장지표와 같은 GDP의 보완지표를 바탕으로 정책 성과 평가와 예산 수립 기준을 세워야 한다”고 말했다.
한편 이헌재 전 경제부총리 등 정책 전문가·연구자·활동가·기업인 622명은 16일 ‘GDP를 넘어서는 새로운 발전지표 요청’ 청원서를 통계청장에게 전달했다. 이들은 “국가 전체의 성과를 살펴보는 데 환경과 사회 등 가치를 포함하는 잣대가 필요하다”고 새로운 지표 도입을 촉구했다. 이 전 부총리는 “GDP만으로는 환경이나 공동체의식 등 새롭게 떠오르는 가치를 평가하기 어렵다”며 “미래 가치를 담은 새로운 발전지표를 만들어 경제구조를 전환하는 잣대로 삼아야 한다”고 밝혔다.",2022-02-16 22:11:01,경향신문,https://n.news.naver.com/mnews/article/032/0003128918?sid=101,GDP 성장률
"한은 ""딥러닝 기술, 경제 성장률 예측력 비교적 높아""","(서울=연합뉴스) 김유아 기자 = 빅데이터에 특화한 딥러닝(기계 자체 학습) 기술이 국내총생산(GDP) 성장률을 예측하는 데에 효과가 있는 것으로 나타났다.
한국은행 디지털혁신실의 이현창 디지털신기술반장 등은 3일 '디지털 신기술을 이용한 실시간 당분기 경제전망(GDP nowcasting) 시스템 개발' 보고서에서 이같이 밝혔다.
보고서에 따르면 주요국 중앙은행이 활용하는 DFM(동적요인모형·Dynamic Factor Model)에 딥러닝 모형인 LSTM(Long Short-Term Momery)을 더한 실시간 경제전망 시스템을 평가한 결과, LSTM의 GDP 성장률 예측력이 비교적 높은 것으로 조사됐다.
코로나19 유행으로 경기가 악화한 2020년 1분기의 경우, LSTM은 GDP 성장률의 예상 속보치를 실제(-1.4%)와 가까운 -1.1%로 계산했다. 반면 DFM은 -0.4%로 예상하며 다소 차이를 나타냈다.
한국은행은 매 분기가 끝나고 한 달 후 GDP 속보치를, 두 달 후 잠정치를, 그리고 매년 3월에 확정치를 제시한다. 이에 따라 평가는 2017년 1분기부터 2021년 3분기까지 매주 발표된 경제지표를 이용해 GDP 속보치, 잠정치를 계산하는 방식으로 진행됐다.
두 모형 다 GDP가 2020년 1분기와 2분기에 급락하고 3분기에 반등할 것이라는 점을 조기에 포착했지만, LSTM의 경우 코로나19 확산과 같은 경제 불확실성이 큰 상황에서 더 높은 예측력을 보였다는 게 보고서 설명이다.
DFM의 경우 속보치와 잠정치에 대한 예측 오차가 큰 차이 없었지만, LSTM의 경우 더 많은 자료를 확보한 뒤 계산하는 잠정치에 대한 예측 오차가 더 작은 것으로 나타났다.
보고서는 ""이는 딥러닝 모형이 실제 경기상황을 포착하는 데에 더 유리하다는 점을 시사한다""라면서 ""대체 데이터를 발굴하는 등 노력이 이어진다면 광범위한 데이터에 기반한 경제전망 체계를 활용해 더 빠르고 효율적으로 정책을 시행할 수 있을 것""이라고 말했다.
이어 ""한국은행은 이번 시스템 개발에서 축적된 디지털 신기술 활용 노하우를 경제전망, 시장 모니터링 등 다양한 조사연구 업무에 적용할 것""이라고 덧붙였다.
kua@yna.co.kr",2022-02-03 12:01:11,연합뉴스,https://n.news.naver.com/mnews/article/001/0012955259?sid=101,GDP 성장률
"한은, 딥러닝 기술로 GDP 실시간 예측","주요국서 쓰는 모형에 딥러닝 분석 활용
경기 흐름 빠르게 파악해 통화정책 수행
[서울경제]
한국은행이 딥러닝 알고리즘을 통해 국내총생산(GDP) 성장률을 빠르게 예측할 수 있는 시스템을 개발했다. 분기별 GDP가 공표되기 전에 경기상황을 파악해 통화정책 수행에 활용한다는 계획이다.
3일 한은은 ‘디지털 신기술을 이용한 당분기 경제전망 GDP 나우캐스팅(nowcasting) 시스템 개발’ 보고서를 통해 “현재 경기흐름에 대한 신속하고 정확한 판단지표를 제공하기 위해 실시간 당분기 경제전망 시스템을 개발했다”고 밝혔다. GDP 성장률을 통해 국가 경제 상황을 종합적으로 파악하고 있지만 공표 주기(1분기)와 시차(속보치 기준 1개월)가 길어 시의성이 떨어진다는 한계가 있다. 이에 매주 GDP 성장률 예측치를 최신화해 경기 흐름을 파악하는 시스템을 구축한 것이다.
연구진은 주요국 중앙은행이 주로 활용하는 동적요인모형(DFM·Dynamic Factor Model)과 딥러닝 모형인 LSTM(Long Short-Term Memory) 알고리즘을 상호보완적으로 이용했다. DFM은 경제변수 간 구조적 관계를 이용해 각 변수에 포함된 정보를 효율적으로 추출할 수 있고, LSTM 알고리즘은 딥러닝 네트워크를 이용해 여러 변수 간 비선형·상호의존적 관계를 포착하는 데 효과적이다.
분석 결과 DFM과 LSTM 모두 전망 시점별로 예측 오차가 시간에 따라 축소되면서 경기 흐름을 적절하게 잡아냈다는 설명이다. 코로나19 팬데믹(세계적 대유행)으로 경기 불확실성이 확대됐던 지난 2020년에 대한 실시간 전망을 살펴보면 DFM과 LSTM 모두 1분기와 2분기에 급격한 GDP 성장률 하락을 예측했고, 3분기 성장률 반등 움직임도 조기 포착에 성공했다. 특히 LSTM 전망모형이 지난 2020년 상반기 급격한 성장률 하락 폭을 상대적으로 정확하게 짚었다.
한은은 이번에 개발한 GDP 나우캐스팅 시스템이 기존 계량경제모형보다 예측력이 개선됐다고 평가했다. 또 디지털 기술 발전으로 고빈도, 비정형, 대체 데이터 등 다양한 빅데이터가 생산·축적되는 상황에서 이러한 자료를 경제 전망에 활용할 수 있는 체계도 갖췄다. 다만 실시간 GDP 예측치를 공개할지는 정해지지 않았다. 이현창 한은 디지털신기술반장은 “한은 대외 커뮤니케이션 정책상 당분기 예측치를 공유하는 것이 통화정책 수행에 도움이 된다면 검토해볼 수 있다”고 말했다.",2022-02-03 12:01:02,서울경제,https://n.news.naver.com/mnews/article/011/0004014640?sid=101,GDP 성장률
"日, 작년 경제성장률 1.7%…3년 만 '상승 전환'","일본 경제가 3년 만에 상승 전환했다.
일본 내각부는 지난해 실질 국내총생산(GDP)이 전년 대비 1.7%(속보치) 증가했다고 15일 밝혔다. 일본의 실질 GDP는 2019년 -0.2%, 2020년엔 -4.5%를 기록했다. 두 해 연속 마이너스 성장을 겪은 일본 경제가 지난해 회복세를 보인 것이다.
작년 분기별 성장률을 보면 1분기 -0.5%, 2분기 0.6%, 3분기 -0.7%, 4분기 1.3% 등으로 신종 코로나바이러스 감염증(코로나19) 상황에 따라 경기 흐름이 큰 폭으로 변동했다.
지난해 4분기 성장세를 보인 것은 일본 GDP의 절반 이상을 차지하는 개인소비가 회복한 데 따른 것으로 보인다. 코로나19 방역 비상조치인 긴급사태가 작년 9월 말 해제되면서 4분기 개인소비가 전 분기 대비 2.7% 늘었다.
다만 올해 들어 오미크론 변이 확산에 따라 일본 47개 도도부현(광역지자체) 중 36개 광역지자체에 방역 비상조치인 '만연 방지 등 중점조치'가 적용되면서 개인소비가 다시 위축될 가능성이 있다.",2022-02-15 10:54:01,한국경제,https://n.news.naver.com/mnews/article/015/0004663734?sid=104,GDP 성장률
