title,content,published_at,media_name,url,keyword
"""카드빚으로 돈 쓴다""…'소비 폭발'에 가계부채 사상 최대 [조미현의 외환·금융 워치]","가계대출은 감소 전환
한은, 올해 3분기 가계신용
은행 대출과 결제 전 카드 대금 등을 포함한 전체 가계 빚이 올해 3분기 역대 최대치를 기록했다. 부동산 시장이 얼어붙고 기준금리가 인상되면서 대출은 감소했지만, 코로나 엔데믹으로 카드 사용액이 크게 늘어난 데 따른 것이다. 물가 상승으로 실질임금은 감소했는데 소비가 늘어나면서 향후 소비 전망은 불투명하다.
한국은행이 22일 발표한 '2022년 3분기 가계신용(잠정)'에 따르면 3분기 말 기준 가계신용 잔액은 전 분기 대비 0.1%(2조2000억원) 늘어난 1870조6000억원을 기록했다. 지난 2013년 2분기 이후 38분기 연속 증가세를 이어갔다.
가계신용은 가계가 은행·보험사·대부업체·공적 금융기관 등에서 받은 대출에 결제 전 카드 사용금액(판매신용)을 합친 '포괄적 가계 빚(부채)'을 의미한다.
가계신용이 역대 최대 기록을 갈아치운 것은 사회적 거리두기 해제에 따른 '보복 소비' 영향 때문이다. 결제 전 카드 대금 등이 포함된 판매신용은 113조8000억원으로, 역대 최대치로 나타났다. 신용카드사를 비롯해 여신전문회사 중심으로 전 분기 대비 2조5000억원 증가했다. 전년 동기 대비로는 13조2000억원(13.2%) 증가한 수치로, 증가율로도 역대 최대였다.
실제 민간 소비(실질)는 올해 1분기 전 분기 대비 -0.5%를 기록했지만 2분기(2.9%)와 3분기(1.9%)로 증가세를 보였다. 다만 부동산 등 자산 가격이 하락하고 기준금리 인상이 계속되면 소비 역시 위축될 가능성이 높다는 전망이 많다. 특히 물가 상승 등의 영향으로 실질 소득은 줄어든 것으로 나타나면서 현재 경제성장을 떠받치고 있는 민간 소비의 기초체력은 점차 약화할 것이라는 관측이다. 통계청에 따르면 올해 3분기 가구당 월평균 소득은 486만 9000원으로 지난해 같은 기간보다 3% 늘었지만, 실질 소득은 2.8% 감소했다.
가계대출은 1756조8000억원으로 3개월 전에 비해 3000억원 줄어든 것으로 나타났다. 올해 1분기(-8000억원) 사상 처음으로 감소한 가계대출은 역대 두 번째로 마이너스를 기록했다.
신용대출을 포함한 기타대출이 4분기 연속 감소세를 이어간 데 따른 것이다. 기타대출 잔액은 748조9000억원으로, 전 분기 대비 6조8000억원 줄어들었다.
가계대출에서 큰 비중을 차지하는 주택담보대출은 1007조9000억원으로, 같은 기간 6조5000억원 늘었다. 하지만 증가 폭은 전 분기(8조7000억원)보다 줄었다. 박창현 한은 금융통계팀장은 ""주택담보대출 증가 폭이 주택거래 부진 등으로 축소됐고, 기타대출은 대출금리 상승과 대출 규제 등의 영향으로 4분기째 줄었다""고 설명했다.
박 팀장은 향후 가계신용 전망에 대해 ""정부의 일부 주택담보대출 규제 완화, 예금은행의 대출태도 완화 등은 증가 요인""이라며 ""하지만 감소 또는 제약 요인으로 대출금리 상승세 등이 남아있다""고 말했다.",2022-11-22 14:56:01,한국경제,https://n.news.naver.com/mnews/article/015/0004777851?sid=101,가계부채
"가계부채 위험, 소득파악 없이 관리 못한다 [동아시론/이정환]","가계부채 1900조원 육박, 한 해 GDP 수준
경제위기 빨간불에도 위험성 분석은 미흡
소득자료 확보 후 부채 리스크 관리해야
11월 미국 연방공개시장위원회(FOMC)에서 제롬 파월 미 연방준비제도(Fed·연준) 의장은 인플레이션 압력에 대응하기 위해 기준금리를 보다 적극적으로 올릴 것임을 시사했다. 미국의 금리 인상 강화 기조에 따라 11월 금융통화위원회에서 사상 최초로 두 번 연속으로 기준금리를 0.5%포인트 인상할 가능성이 여느 때보다 높아졌다. 이러한 미국의 금리 인상 기조는 내년에도 지속될 것으로 예상되며, 이에 따라 한국 기준금리 역시 2008년 금융위기 직전의 4∼4.5% 수준까지 도달할 것이란 예측이 나온다.
시장의 대출 금리는 기준금리 인상의 강도와 그 지속 기간에 큰 영향을 받는다. 실제 9월까지만 해도 시중은행의 연말 대출 금리 상단이 8%까지 도달할 것으로 예상했다. 그러나 금리 인상 기조가 강화되자 연말 대출 금리 상단은 9%에 이르고, 내년에는 10% 수준까지 올라갈 것이라는 전망이 확산되고 있다. 돈을 빌린 차주 입장에서 유례없이 빠르게 금리가 올라가고 있는 상황이다.
가파른 금리 상승은 차주와 기업 그리고 더 나아가 경제 전체에 문제를 수반한다. 기준 금리 상승은 변동 금리 산출에 기준이 되는 코픽스 금리를 상승시켜, 이자 상환 부담을 증가시킨다. 이자 상환 부담이 커질수록 개별 가구는 소비를 줄이고, 결국 시장 전체의 수요 감소를 유도한다. 이러한 수요 감소에 직면한 기업 중 일부는 결국 부도에 이르게 된다.
취약 차주들의 문제는 더욱 심각하다. 금리가 인상될수록 취약 차주들은 대출 자체를 갚기 어려워지며 이에 따라 신용 불량자가 될 가능성이 커진다. 이러한 상환 불가 상태를 우려한 금융권이 취약 차주에 대한 대출을 중단하면 이들은 결국 초고금리의 사채시장으로 밀려 나가게 된다. 또한 가계에서 대출을 갚기 위해 부동산을 매각하기 시작하면 일촉즉발의 위기에 있는 부동산 시장에서 가격 급락을 야기할 수 있다. 이에 따른 부동산 담보가치 하락 및 추가적인 부실은 금융시스템 붕괴, 나아가 경제 위기 상황으로 이어질 수 있다.
현재 가계부채는 한 해 국내총생산과 비슷한 수준인 1900조 원에 육박했다. 특히 국내 가계부채는 변동 금리형 대출이 70∼80%를 차지하고 있어, 가계부채가 경제 위기를 촉발시키는 뇌관으로 작동하는 게 아니냐는 우려가 확산되고 있다. 가계부채에 있어 부동산 담보 대출 비중이 높아 위험이 작다는 의견도 있지만, 가격이 급락하고 있는 현재 부동산 시장 상황을 볼 때 안심할 수 없다. 특히 ‘영끌’해 주택을 구매한 청년층이나 코로나 기간에 어려움을 겪은 자영업자들에 대한 우려가 심각하다.
이처럼 가계부채의 위험성이 날로 커지고 있지만 이 문제에 대한 위험성 분석은 미흡한 실정이다. 현재 38만 가구 정도가 매우 위험한 것으로 추산되지만, 이 역시 현재 시점에서 단편적인 총부채상환비율(DTI), 총부채원리금상환비율(DSR) 기준에 의한 추산치다. 금리가 급격하게 변화하는 시점에는 경기 수축 강도별 시나리오에 따른 가구별 부채 부실 위험을 측정하는 스트레스 테스트와 같은 미시 건전성 분석이 절실하다.
이러한 필요성에 부응해 현재 통계청에서 가구 부채와 근로소득, 부동산 보유 등을 기준으로 국민 전체의 가구 부채 수준 위험성 분석을 수행하고 있으며, 필자 역시 연구원으로 연구에 참여하고 있다. 그러나 통계청과 유관 기관의 많은 노력에도 불구하고 기관 간 협조의 어려움, 짧은 표본 기간 등으로 인해 분석 수행에 어려움이 있다. 가장 심각한 문제는 종합소득 관련 자료가 없다는 점이다. 특히 부동산 시장 비중이 높은 국내 자산 구조상 부동산 임대소득이나 여타 금융자산으로 인한 소득 자료가 확보돼야 개별 가구의 정확한 소득 흐름을 알 수 있으며, 가구별 부채 위험성의 측정이 가능하다. 종합소득 자료가 있는 국세청의 적극적인 협조가 필요하다.
국제통화기금(IMF) 외환위기의 경우 지나친 기업부채 중심이 위기를 촉발했다. 반면 2022년 지금은 정부부채, 기업부채, 가계부채가 모두 급증하여 어느 한 부문의 위험이 신용 위험 전이를 통해 급격한 경기 수축을 초래할 수 있다. 이를 대비하기 위해 적극적인 미시 건전성 분석을 통한 가구 부채 위험 분석과 그 결과에 따른 통화정책 운영이 중요하다. 가계부채 위험이 지나치다고 판단되면, 신용회복 정책 등 선제적인 가구 부채 리스크 관리를 병행해 지금의 위기를 슬기롭게 극복해야 한다.",2022-11-05 03:01:22,동아일보,https://n.news.naver.com/mnews/article/020/0003460452?sid=110,가계부채
"[이슈& 직설] 한국 가계부채, GDP 대비 '세계 1위'...국내은행 8월 대출 연체율 0.24%, 전월보다 0.02%P↑","■ 경제 와이드 이슈& '직설' - 석병훈 이화여대 경제학과 교수, 허준영 서강대 경제학부 교수, 김성은 세종대 경제학과 교수
- GDP 웃도는 가계부채, 괜찮을까?
- 한국 가계부채, GDP 대비 '세계 1위'
- 현대硏 ""가계부채 고려하면 금리 인상 속도 조절해야""
- 금리인상기 기업 대출 증가↑…정책 지원 필요할까?
- 국내은행 8월 대출 연체율 0.24%...전월보다 0.02%P↑
(자세한 내용은 동영상을 시청하시기 바랍니다.)",2022-11-07 13:41:01,SBS Biz,https://n.news.naver.com/mnews/article/374/0000309556?sid=101,가계부채
"[사설]가계부채 비율 1위, 기업 빚 증가 2위… 국가채무도 전철 밟나","한국 기업들의 빚 증가 속도가 세계 주요국 중 2위인 것으로 조사됐다. 국내총생산(GDP) 대비 가계부채 비율은 1년 전보다 줄었는데도 여전히 부동의 1위다. 게다가 정부부채 증가속도도 빨라지고 있다. 기업·가계·정부 모든 경제주체가 부채에 짓눌려 가는 모습이다.
국제금융협회(IIF)의 세계 부채 보고서에 따르면 6월 말 한국의 GDP 대비 가계부채 비율은 102.2%로 35개 조사 대상 주요국 가운데 1위였다. 1년 전 105.2%보다 낮아졌지만 가계가 국가경제 크기보다 많은 빚을 진 나라는 한국뿐이다. 주택담보대출, 전세대출, 신용대출 최고금리가 모두 7%를 넘어서면서 이자부담 증가에 따른 소비위축, 가계파산 우려도 커지고 있다.
IIF 조사에서 한국 비금융 기업들의 GDP 대비 부채 비율은 홍콩 싱가포르 중국에 이어 35개국 중 4위지만 비율은 117.9%로 역시 GDP보다 많고, 1년 전보다 증가한 폭은 베트남에 이어 2위다. 기업들이 코로나19를 거치면서 빚으로 연명하고 있다는 뜻이다. 더욱이 최근 레고랜드 사태로 채권시장이 얼어붙어 새로 채권, 기업어음을 발행해 만기가 된 빚을 갚는 것조차 힘들어지고 있다.
가계, 기업 부채 문제 대응에는 재정의 역할이 필수적인데 나라 곳간 사정도 나빠지고 있다. 국제통화기금(IMF)에 따르면 올해 말 한국의 GDP 대비 일반정부 부채비율은 54.1%로 사상 처음 비기축통화 선진 11개국 평균(53.5%)을 넘어서고, 5년 뒤 격차가 7.5%포인트로 벌어질 전망이다. 미국, 일본 등 기축통화국과 달리 비기축통화 선진국들은 국가신용도 등을 고려해 50% 안팎에서 부채비율을 관리하는데 한국만 급속히 비율이 높아지는 것이다.
상황이 이런데도 여야 정치권은 나랏빚을 늘리지 않으면 실행할 수 없는 정책들을 내놓고 선심성 돈 풀기 경쟁을 벌이고 있다. 가계, 기업 부채 해결 과정에서 수반될 고통을 국민들에게 납득시키려면 정부부터 먼저 허리띠를 졸라매야 한다.",2022-11-01 00:01:04,동아일보,https://n.news.naver.com/mnews/article/020/0003459481?sid=110,가계부채
"기준금리 인상 행진 멈췄다... 한은, 경기 방어 위해 3.5% 동결","이창용 총재 “금리 인상 끝났다는 의미는 아냐”
한국은행이 23일 금융통화위원회를 열고 기준금리를 현 수준인 연 3.5%로 동결했다. 국내 경기 둔화와 부동산 가격 하락 등을 고려해 작년 4월 이후 7번 연속 올렸던 금리를 이번에 묶어두기로 결정했다.
이날 이창용 한은 총재는 금통위 정례회의 직후 기자간담회에서 “목표 수준을 웃도는 물가 오름세가 연중 이어질 것으로 전망되고 정책 여건 불확실성도 높다”며 “인플레이션 둔화 속도와 불확실성 요인들의 전개 상황을 점검하면서 추가 인상 필요성을 판단해 나가는 것이 적절하다고 보았다”고 동결 배경을 밝혔다.
다만 이 총재는 “이날 동결 결정이 금리 인상 기조가 끝났다는 의미는 아니다”고 강조했다. 그러면서 “지난해 물가가 이례적으로 급등해 매회 금리를 인상했지만, 그 이전 시기에는 인상하더라도 시간을 두고 추가로 인상할지를 검토해왔다”고 설명했다.
한은은 앞서 코로나 팬데믹으로 인한 경기 침체가 예상되자 빠른 속도로 기준금리를 인하했다. 2020년 3월 금통위는 기준금리를 한 번에 0.5%포인트 낮추는 ‘빅컷’에 나섰고, 두 달 뒤 추가 인하(0.25%포인트)로 2개월만에 금리를 0.75%포인트 내린 것이다. 이후 아홉 번의 동결 과정을 거친 뒤 지난해 8월, 15개월 만에 0.25%포인트를 올리며 이른바 ‘통화정책 정상화’에 나섰다. 이후 기준금리는 지난해 1·4·5·7·8·10·11월과 올해 1월까지 0.25%포인트씩 여덟 차례, 0.50%포인트 두 차례, 모두 3.00%포인트 높아졌다. 이번 동결로 2021년 8월부터 지난달까지 1년 5개월 동안 이어진 금리 인상 기조가 깨졌다는 해석이다.
한은이 이번에 인상보다 동결에 방점을 찍은 것은, 불안한 국내 경기 상황에 대한 고려가 컸다는 분석이다. 실제로 한국 경제는 반도체·중국·에너지 등 ‘트리플 악재’로 휘청이는 상황이다. 주력 수출 상품인 반도체와 최대 수출국인 중국 수출 부진이 장기화하면서 경제 버팀목인 수출이 5개월 연속 감소하고 있다. 이에 기획재정부가 지난 17일 경기 둔화를 공식 인정할 정도로 경기가 하강 국면인데, 기준금리를 추가로 올릴 경우 향후 경기 침체 가능성이 그만큼 커질 수 있었다. 한은으로써는 추가 긴축 부담이 높을 수밖에 없었다는 얘기다.
가계부채가 코로나 팬데믹 기간 초저금리와 투자 열풍으로 크게 불어난 가운데 기준금리를 지나치게 올릴 경우 많은 가계의 이자 부담이 커질 수 있다는 점도 고려한 것으로 보인다. 금리를 더 올릴 경우 부동산 시장 경착륙에 따른 금융 시장 충격까지 연쇄 파장까지 우려되는 상황이었다.
이번 금리 동결은 물가보다는 경기를 더 강조하는 정부 방침에 보조를 맞춘 것이란 해석도 나온다. 앞서 추경호 부총리 겸 기재부 장관은 “만약 물가 안정 기조가 확고해지면 모든 정책 기조를 경기 쪽으로 턴(turn·전환)해야 한다”며 경기 방어의 필요성을 강조한 바 있다.
그러나 이번에 금리를 동결하면서 한·미 금리 역전폭 확대에 대한 리스크는 더욱 커지게 됐다. 한국 기준금리는 연 3.5%로 유지되지만, 미국은 금리 인상 기조가 아직 꺾이지 않은 상황이다. 현재 4.75%인 미국 기준금리는 3월은 물론 5월과 6월까지 0.25%포인트씩 차례로 올라 5.5%까지 오를 것이란 관측이 힘을 얻고 있다. 이렇게 되면 한·미 금리차가 2%포인트 안팎 역대 최대치로 벌어질 수 있고, 외국인 자금 유출이나 원화의 상대적 가치 하락(환율 상승) 압력 등과 같은 후유증이 발생할 가능성이 있다.
이날 이 총재는 최종금리를 더 올릴 가능성도 시사했다. 그는 “이번 회의에서 금통위원 1명은 최종금리를 현 3.5% 수준에서 동결하는 것이 적절하다고 한 반면, 나머지 5명은 당분간 최종금리를 3.75%로 가져갈 가능성을 열어놔야 한다고 했다”고 전했다.
한편 한은은 이날 ‘수정 경제전망’을 내놓고 올해 우리나라 경제성장률도 기존 1.7%에서 1.6%로 0.1%포인트 낮췄다. 세계 경제 침체 우려가 여전한 가운데 수출 의존도가 높은 한국 경제의 성장률 전망을 더 낮춘 것이다. 이 총재는 “미국과 유럽의 경기 연착륙 가능성, 중국의 경기 회복 등으로 상향 조정 요인이 0.2%포인트 있었지만, 국내 IT 경기 부진과 부동산 경기 둔화 등 하향 요인이 -0.3%포인트 있었다”고 배경을 설명했다.
앞서 이 총재는 지난 1월 기준금리 발표 뒤 기자회견에서 “지난해 11월에는 (올해 한국 성장률을) 1.7%로 봤는데, 한 달 좀 넘었지만, 그 사이의 지표로 볼 때 성장률이 그보다 낮아질 가능성이 클 것 같다”고 한 바 있다. 한은은 이번에 올해 소비자물가 상승률 전망을 3.6%에서 3.5%로 0.1%포인트 소폭 낮췄고, 2024년 경제성장률은 2.4%로 내다봤다.",2023-02-23 09:51:03,조선일보,https://n.news.naver.com/mnews/article/023/0003747960?sid=101,가계부채
현대硏 “연말 적정 금리 4%지만 가계부채 고려하면 속도 조절해야”,"물가·환율 고려한 적정 금리 3.73~4.02%
美 적정 금리와의 격차는 0.52~1.12%P
가계부채 고려하면 급격한 금리 인상 안돼
[서울경제]
미국 연방준비제도(Feb·연준)의 가파른 금리 인상으로 연말 한미 금리 역전 폭이 100bp(1bp는 0.01%포인트) 이상 벌어질 것이란 전망이 나오고 있다. 현대경제연구원은 한미 금리 격차가 적정 수준에서 유지될 수 있도록 정책 역량을 발휘하는 동시에 과도한 통화 긴축으로 경기를 훼손하지 않아야 한다는 주문을 내놓았다.
2일 현대경제연구원은 ‘한미 적정 기준금리 추정과 시사점’ 보고서를 통해 테일러 준칙으로 산출한 올해 4분기 한미 간 적정 기준금리 차이가 0.52~1.12%포인트라고 밝혔다. 이날 기준으로 한미 금리 역전 폭은 0.25%포인트로 한국 시간으로 3일 오전 3시에 발표되는 미국 연방공개시장위원회(FOMC) 결과에 따라 1.0%포인트까지 확대될 가능성이 제기된다.
연구원은 한국의 금리 정책 운용은 경제 성장, 물가 안정과 함께 환율 안정까지 고려한다는 전제로 적정 금리를 추정했다. 추정 결과 4분기 한국의 적정 금리는 3.73~4.02%로 시장 전망치(3.25~3.50%) 대비 0.23~0.77%포인트 높게 측정됐다. 미국은 물가와 경제 성장만 고려했을 때 연말 적정 금리가 4.54~4.85%로 시장 전망치( 4.25~4.5%)보다 높다.
연구원은 올해 말 한국의 실제 금리는 적정 금리 수준을 다소 하회할 것으로 예상했다. 연내 남은 금융통화위원회가 한 번뿐인 만큼 적정 금리에 도달하려면 한 번에 0.75~1.00%포인트의 급격한 금리 인상이 필요하기 때문이다. 다만 가계부채 등을 고려했을 때 급격한 금리 인상은 경기 침체를 유발하기 때문에 서서히 적정 금리 수준에 도달하도록 통화정책을 운용하는 것이 바람직하다는 결론이다.
그러면서 연구원은 한국의 기준금리가 적정금리와 크게 벌어질 경우 물가 안정 효과가 약해질 수 있다고 우려했다. 한미 금리 역전 폭이 적정 수준보다 벌어질 경우 금융시장 불안이나 외환시장 불안도 나타날 수 있다는 지적이다.
이형석 현대경제연구원 연구위원은 “고물가, 고금리에 글로벌 경기 침체 우려로 국내 경기 하강 가능성이 크게 높아진 상황이기 때문에 정책 방향을 ‘물가 안정’ 뿐만 아니라 ‘경기 침체 방어’까지 고려해야 한다”라며 “금리 인상시 발생할 수 있는 가계부채 부실화에 대한 대비가 필요하다”고 말했다.",2022-11-02 11:01:04,서울경제,https://n.news.naver.com/mnews/article/011/0004117442?sid=101,가계부채
"고금리 속 가계부채 '빨간불'…당정, 서민금융 지원 확대","[앵커]
급격한 금리 인상으로 민생경제의 어려움이 가중되고 있는 가운데, 여당과 정부가 서민금융 지원 확대에 머리를 맞댔습니다.
당정 협의회에선 채무자 보호법 제정 추진과 함께 세부 지원책 마련에 나섰는데요.
최지숙 기자입니다.
[기자]
빠르게 늘고 있는 가계부채가 경제 뇌관으로 떠오르자 당정은 주말에 협의회를 갖고 대책 마련에 나섰습니다.
<주호영 / 국민의힘 원내대표> ""이대로 감내하라고 할 수는 없고 정부와 당이 이렇게 이자율이 올라간 상황에서 부담을 어떻게 합리적으로 조정하고 덜어줄 수 있을까 논의하기 위해…""
두시간여 동안 진행된 민생금융점검 회의를 통해 정책 서민금융 공급 규모를 현행 10조원에서 12조원까지 확대하고, 개인 채무자 보호법을 추진하는 데 공감대를 모았습니다.
<성일종 / 국민의힘 정책위의장> ""금융회사와 채무자 간 자율적인 채무조정을 제도적으로 뒷받침하기 위해 개인 채무 보호자 법을 제정하겠습니다.""
사금융에 내몰리는 취약계층을 보호하는 취지로, 채무 조정 활성화와 연체 시 부담 완화, 수신 관행 개선 등 내용을 담아 연내 국회에 제출한다는 방침입니다.
또 생계비 소액대출 제도를 신설하고, 안심전환대출은 내년부터 주택가격 9억원까지 그 대상을 확대하기로 했습니다.
국민 생활과 직결된 문제 중 하나인 자동차 보험료 부담 경감책도 논의됐습니다.
<성일종 / 국민의힘 정책위의장> ""손해보험협회에 이에 대한 주문을 했습니다. (자동차 보험료) 부담을 경감하도록 시장에서 자율적으로 기능을 조정할 수 있도록 도와달라는…""
이밖에 금융회사별 대출금리를 비교해 낮은 금리로 갈아탈 수 있는 '온라인 원스톱 대환 대출' 인프라 구축 역시 대책에 포함됐습니다.
경제 위기의 파고 속에, 당정은 체감 가능한 실효적 대안들을 속도감 있게 추진해가겠다는 계획입니다.
연합뉴스TV 최지숙입니다. (js173@yna.co.kr)
#가계부채 #금융 #당정 #민생경제 #채무자보호법
연합뉴스TV 기사문의 및 제보 : 카톡/라인 jebo23",2022-11-07 07:26:02,연합뉴스TV,https://n.news.naver.com/mnews/article/422/0000568698?sid=100,가계부채
"니혼게이자이 ""세계적 주택 가격 하락세 속 韓 가계부채 위험""","일본 니혼게이자이신문이 ""전 세계 집값 하락세 속에 특히 한국 시장 침체가 가계에 미칠 영향이 우려된다""고 보도했습니다.
신문은 ""한국의 가처분소득 대비 부채 비율은 약 200%로 세계 최고 수준이며, OECD 회원국 중 두 번째로 높다""고 지적했습니다.
이어 ""최근 5년간 아파트값이 무려 2배로 뛰면서 소득수준에 맞지 않는 주택담보대출을 받은 가구도 적지 않다""며 ""대출의 80% 이상이 변동금리이기 때문에 이자 부담 증가가 크다""고 설명했습니다.",2022-11-21 05:36:01,SBS Biz,https://n.news.naver.com/mnews/article/374/0000311293?sid=101,가계부채
