title,content,published_at,media_name,url,keyword
“우리집 빚 좀 줄었나”…가계부채 10년만에 꺾인 속사정 보니,"작년 4분기 가계신용 1867조원
4.1조원 줄어 2013년 이후 첫 감소
가계대출도 연간7.8조원 줄어
부동산침체·대출금리 상승 영향
한은 “당분간 확대 가능성 낮아”
세계최고 가계부채 감축 기회
“경착륙 막을 정책과 감시 필요”
치솟던 가계빚이 한국은행의 가파른 금리인상과 부동산시장 침체에 따른 주택대출 수요 감소로 지난해 4분기 10년만에 처음으로 꺾였다. 올해 경기둔화가 본격화되는데다 한은의 긴축기조도 당분간 이어질 것으로 보여 가계부채 ‘디레버리징’에 속도가 붙을 것으로 전망된다.
21일 한국은행에 따르면, 지난해 4분기(10~12월) 가계신용 잔액은 약 1867조원으로 전분기 말보다 4조1000억원(-0.2%) 감소했다. 가계신용이 감소한 것은 2013년 1분기 이후 약 10년만으로, 감소폭으로만 따져도 역대 최대 수준이다.
가계신용은 시중은행 등 금융권 전체 가계때출과 결제되지 않은 카드대금 등 판매신용을 더한 가계가 지고 있는 빚을 뜻한다.
가계대출이 1749조 3000억원으로 전분기보다 7조500억원 감소한 영향이 컸다. 역대 최대 감소폭이자 직전분기에 이어 2개 분기 연속 감소다. 지난해를 통틀어서도 7조8000억원 감소해 통계 편제 이래 연간 기준 최초로 감소했다. 주택담보대출(주담대)은 증가세가 줄어들고 있고 신용대출이 포함된 기타대출이 큰 폭 감소했기 때문이다.
실제 4분기 주담대는 1012조6000억원으로 전분기보다 4조7000억원 늘어나는데 그쳤다. 전년 같은 기간에 비해서도 2.9%만 늘며 역대 최소폭 증가했다. 부동산시장이 침체되며 주택거래가 줄어든게 원인이었다. 같은 기간 전국 주택매매와 전세 거래량은 9만1000호, 29만2000호로 전분기보다 각각 1만7000호, 4000호 감소했다.
4분기 기타대출은 전분기보다 12조2000억원(-1.6%) 줄어든 736조7000억원으로 나타났다. 감소폭과 감소율 모두 역대 최대다. 기타대출은 5개분기 연속 감소했다. 한은의 긴축기조에 따른 급격한 대출금리 상승과 정부의 대출규제가 작용한 결과다. 박창현 한은 금융통계팀장은 “대출금리 상승세와 DSR(총부채원리금상환비율) 3단계 적용 등 대출 규제가 이어진 영향”이라고 설명했다.
기관별로는 예금은행과 비은행예금취급기관 모두 감소했는데 비은행 기관의 감소폭이 더 컸다. 특히 비은행 기관의 가계대출 잔액은 3조8000억원(-1.1%) 줄었다. 정부의 안심전환 대출 등으로 비은행 기관의 주담대가 1금융권인 예금은행으로 이동했기 때문이다. 보험사, 증권사 등 기타금융기관의 가계대출은 전분기보다 3조3000억원(-0.7%) 줄었다.
가계부채는 대체로 감소했지만 카드대금 등이 포함된 판매신용은 8개분기 연속 증가해 117조7000억원으로 역대 최대 수준으로 조사됐다. 전분기보다 3조4000억원 늘어난 수치다. 박 팀장은 “코로나19 사태 이후 비대면소비가 활성화되면서 신용카드 사용이 일반화되고 작년 사회적거리두기 해제 이후 소비가 회복된 영향도 있었다”고 말했다. 판매신용은 지난해 11조9000억원 늘어 연간으로 가장 많이 늘었다.
한은은 당분간 가계신용 확대 가능성이 크지 않다고 봤다. 박 팀장은 “1월의 경우 가계부채 축소 흐름이 이어졌다”며 “높은 금리수준과 부동산 경기 부진 등을 고려하면 가계신용이 급격히 확대될 가능성은 크지 않은 것으로 보인다”고 전망했다.
가계부채 디레버리징이 본격화되면서 한국 경제의 고질적인 리스크였던 세계 최고 수준의 가계빚이 개선될 것이라는 전망도 나온다.  국제금융협회(IIF) 발표에 따르면 지난해 1분기 한국의 국내총생산(GDP) 대비 가계부채 비율은 104.3%로 유로존 포함 조사 대상 36개국중 가장 높았다. 2008년 금융위기 이후 주요 선진국에서 본격적인 부채감축이 이뤄진 것과 다르게 한국의 가계부채는 지속적으로 늘어왔다. 하준경 한양대 경제학과 교수는 “한국은 과거 20년동안 디레버리징을 의미있게 한 적이 없다”며 “GDP 대비 가계부채가 70%를 넘으면 성장에 부담이 되는 것으로 연구된만큼 유의미한 디레버리징을 이끌어내야 한다”고 말했다.
다만 가계부채를 감축하는 과정에서 취약차주가 고통받는 경착륙을 피하도록 정책지원이 필요하다는 의견이 나온다. 하 교수는 “갑작스런 부채 감축은 소비와 투자를 위축시키는 ‘부채 후유증’을 야기할 수 있다”며 “금융정책과 재정정책을 통해 유동성 위기를 피하고 적절한 소비가 이뤄질 수 있도록 해야 한다”고 말했다. 성태윤 연세대 경제학부 교수는 “디레버리징의 타당하지만 대출자의 부담이 급격히 늘어나는 것을 조심해야 한다”며 “은행권의 과도한 대출금리 상승을 막을 금융당국의 감시가 필요한 시점”이라고 말했다.",2023-02-22 07:12:01,매일경제,https://n.news.naver.com/mnews/article/009/0005091926?sid=101,가계부채
지난해 4분기 가계부채 사상 최대 폭 감소… 신용대출은 12조 급감,"한국은행 ‘2022년 4분기 가계 신용’
지난해 4분기 가계 부채가 1867조원을 기록해 전분기 대비 4조1000억원 줄었다. 역대 최대 감소 폭이다. 이전 역대 최대 감소는 글로벌 금융위기 직후인 2009년 1월 기록한 3조1000억원이었다. 부동산 경기가 부진한 가운데 높은 대출 금리가 유지된 여파란 풀이다.
한국은행이 21일 발표한 ‘2022년 4분기 가계 신용’에 따르면, 지난해 12월 말 기준 가계 부채(1867조원)는 전분기 대비 가장 큰 폭으로 감소했고, 지난해 같은 기간과 비교하면 4조1000억원 늘며 가장 작은 증가 폭을 기록했다.
가계 신용(가계 부채)은 은행·보험사 등 금융회사의 가계 대출과 소비자가 대금을 결제하기 이전의 카드 판매 대금(판매 신용)을 합쳐서 산출한다. 이중 가계 대출은 지난해 말 1749조3000억원을 기록해 전분기보다 7조5000억원, 전년 동기보다 7조8000억원 줄었다. 한은이 관련 통계를 작성한 2002년 이후 전년 대비 가계 대출이 감소한 것은 처음이다. 가계 대출의 절반 이상을 차지하는 주택담보대출은 1012조6000억원을 기록해 전분기보다 소폭(4조7000억원) 늘었지만 신용대출이 큰 폭으로 감소하면서 전체 가계대출이 크게 줄었다. 지난해 4분기 신용대출을 포함한 ‘기타 대출’은 736조7000억원을 기록 전분기(748조9000억원)보다 12조2000억원 줄었다. 역대 최대치 감소 폭이다.
박창현 한은 금융통계팀장은 “부동산 경기가 부진한 가운데, 대출 금리 상승세가 이어지고, 가계 대출 핵심 규제인 DSR(총부채원리금상환비율) 규제가 지속된 데 따른 영향으로 대출이 감소한 것으로 보인다”고 설명했다.
다만 작년 4분기 카드 판매신용은 2021년 4분기(105조8000억원)에서 동기 대비 11조9000억원 늘어난 117조7000억원을 기록, 큰 폭으로 증가했다. 전년 대비로 보면 작년 3분기(13조7000억원)에 이어 역대 두 번째로 높은 상승폭이다. 코로나 팬데믹 기간 비대면 소비가 활성화하면서 신용카드 결제가 늘어난 가운데, 사회적 거리두기가 계속 완화되며 소비가 늘어난 여파가 있다는 게 한은 설명이다.
한은 관계자는 “향후 부동산 규제 완화 등과 같은 부채 증가 요인은 있지만, 대출 금리가 여전히 높은 편이고 DSR 규제가 여전히 남아 있어 당분간 가계 대출이 크게 확대될 가능성은 크지 않다고 본다”고 말했다.",2023-02-21 12:01:01,조선일보,https://n.news.naver.com/mnews/article/023/0003747532?sid=101,가계부채
"美 가계부채, 고물가·고금리에 20년만에 최대 증가…연체율도↑","(서울=연합뉴스) 김계환 기자 = 미국 가계부채가 지난해 4분기 고물가와 고금리 속에 주택담보대출(모기지)과 신용카드 잔액 급증의 영향으로 20년 만에 가장 큰 폭으로 증가했다고 블룸버그통신 등이 16일(현지시간) 보도했다.
뉴욕 연방준비은행(연은)이 이날 내놓은 가계부채 보고서에 따르면 지난해 4분기에 미국 가계부채는 16조9천억 달러(약 2경1천840조원)로 3천940억 달러(약 509조원), 약 2.4% 늘어났다. 이 같은 증가 금액은 20년 만에 최대다.
코로나19 대유행(팬데믹) 초기와 비교하면 2조7천500억 달러(약 3천556조원)가 늘었다.
가계부채에서 가장 비중이 큰 주택담보대출(모기지)이 가계부채 증가를 주도했다.
지난 분기 말 신규 주택담보대출은 4천980억 달러(약 644조원)로 코로나19 발생 전인 2019년 수준으로 돌아갔다. 하지만 전체 주택담보대출 잔액은 11조9천200억 달러(약 1경5천411조원)로 2천540억 달러(약 328조3천712억원), 약 2.2% 늘었다.
신용카드 잔액도 1999년 이후 가장 큰 폭으로 늘어났으며, 신용카드·자동차 할부대출·주택담보대출의 연체율도 높아진 것으로 나타났다.
여기에는 20대와 30대가 대출금 상환에 어려움을 겪는 점이 큰 몫을 차지한 것으로 분석됐다.
뉴욕 연준 이코노미스트들은 블로그에 올린 글에서 아직 연체율이 코로나19 대유행 전보다는 낮은 수준이지만, 문제는 최근 들어 급증세를 보인다는 점이라고 지적했다.
특히 코로나19로 인한 정부의 학자금 융자금 상환 유예 조치가 끝나는 올해 하반기부터 젊은 층의 부채 증가 폭이 더욱 커질 수 있다고 관측했다.
이에 따라 신용카드와 자동차 할부대출 연체율이 빠르게 코로나19 이전 수준까지 높아질 가능성이 있다고 우려했다.
이들은 통상 부채 증가를 불러오는 가장 큰 요인이 실직이지만, 구인난이 심각한 뜨거운 노동시장 상황을 고려하면 최근 가계 부채 증가는 고물가와 고금리 때문일 가능성이 있다고 설명했다.
kp@yna.co.kr",2023-02-17 10:16:21,연합뉴스,https://n.news.naver.com/mnews/article/001/0013762958?sid=104,가계부채
[사설] 한국은행 금리 인상 멈춰도 가계부채 감축 이어져야,"한국은행이 23일 금융통화위원회에서 기준금리를 3.5%로 유지했다. 한은은 코로나 위기를 맞아 0.5%까지 떨어뜨렸던 기준금리를 2021년 8월 회의에서 올리기 시작해 지난 1월 회의에서 3.5%까지 올린 바 있다. 특히 지난해 4월부터는 7차례나 연속 올리다 이번에 동결했다.
한은이 기준금리를 동결하면서 이날 내놓은 수정 경제전망은 금리 인상이 사실상 마무리 단계에 접어들었음을 내비친 것이다. 한은은 올해 국내총생산 성장률을 지난해 11월 전망한 1.7%에서 1.6%로 낮췄다. 3.6%로 봤던 소비자물가 상승률도 3.5%로 낮춰 잡았다. 이창용 총재는 ‘물가상승률이 올해 말에는 3%대 초반으로 내려갈 것’이라며, 이를 가장 중요하게 고려해 금리를 동결했다고 설명했다.
다만, 우리나라와 미국의 금리 차가 벌어질 가능성이 커서, 환율 상승을 억제하는 수준의 소폭 인상 여지는 남겨둔 것 같다. 미국 기준금리는 현재 4.75%다. 미국 채권시장 투자자들은 연방준비제도(Fed)가 앞으로 0.25%포인트씩 2~3차례 더 금리를 올릴 것으로 내다본다. 그러면 기준금리가 높게는 5.5%에 이르게 되고, 우리나라와 2%포인트나 차이가 나게 된다. 미국 금리 인상 전망에 힘이 실리면서 2월 들어 원-달러 환율이 올라 한때 1300원을 넘겼다. 이 총재가 “이번 동결을 금리 인상 기조가 끝났다는 의미로 받아들이지 않았으면 한다”고 경계한 것은 이 때문으로 보인다.
금리 인상 중단은 부채가 많은 경제주체들을 한숨 돌리게 할 것이다. 추경호 부총리 겸 기획재정부 장관은 ‘물가 안정 기조가 확고해지면, 정책기조를 경기 쪽으로 전환해야 한다’고 말한 바 있어, 경기 부양에 대한 기대도 점차 커갈 것이다. 그러나 정부가 정책의 무게를 경기 쪽으로 옮기고 싶더라도, 가계부채를 다시 늘리는 정책수단은 피해야 한다. 한국은행 집계를 보면, 우리나라 가계대출은 지난해 4분기에 7조5천억원 줄었고, 1월에 8조원 줄었다. 금리 인상 효과가 지난해 연말께부터 부채 감축으로 이어지기 시작한 것이다. 그러나 가계대출 잔액은 지난해 말 1749조원에 이를 정도로 이미 거대하게 부풀어 있고, 가계부채의 원리금 상환 부담 탓에 가계의 소비 여력은 크게 위축돼 있다. 뒤탈이 없으려면 이참에 적잖은 조정이 이뤄져야 한다. 가장 위험한 것이 주택 대출을 늘리는 부동산 경기 부양이다. 정부가 그 유혹에 넘어가선 안 된다.",2023-02-23 18:11:05,한겨레,https://n.news.naver.com/mnews/article/028/0002628756?sid=110,가계부채
"부동산전문가 90%이상 ""올해 집값 하락""…절반 ""내년 회복""(종합)","올해 하락폭, '5%이상' 예상 가장 많아…KB금융은 -4.1% 전망
KB금융 ""당분간 조정 불가피하지만 부동산 경착륙 가능성 작다""
""가계부채, 금융 리스크 아니다…5년간 DSR 19% 상승에도 연체율 낮아""
(서울=연합뉴스) 신호경 기자 = 부동산 관련 전문가 90% 이상은 올해 주택가격이 5% 가량 더 떨어질 것으로 예상했다. 하지만 내년 집값의 경우 2명 중 1명이 반등을 점쳤다.
KB금융은 당분간 집값 조정이 불가피하지만, 가계대출 규제 상황 등으로 미뤄 가격이 급락하면서 부동산 시장이 경착륙할 가능성은 크지 않은 것으로 봤다.
""작년 집값 1.8%↓…10년 만에 하락""
KB금융지주 경영연구소가 5일 발표한 'KB 부동산 보고서'에 따르면 2022년 전국 주택매매 가격은 1.8% 떨어졌다. 연간 주택매매 가격이 하락한 것은 2012년 이후 10년 만이다.
지역별 하락률은 대구(-5.2%)가 가장 높았고, 대전(-4.4%)과 수도권(-2.7%)이 뒤를 이었다. 광주(2.0%)에서만 유일하게 집값이 올랐다.
주택매매 거래량도 지난해 약 50% 급감했다. 특히 7월 이후에는 월평균 거래량이 약 3만3천 호에 불과했다. 2017∼2021년 월평균 거래량(8만2천 호)의 절반을 밑도는 수준이다.
전셋값 역시 지난해 전국에서 2.5%, 수도권에서 4.0% 하락했다.
부동산 전문가·중개업자·PB ""올해 하락하고 내년 회복 가능성""
연구소는 보고서에서 지난해 12월 12∼26일 건설·시행·학계·금융 등 분야의 부동산 전문가, 전국 중개업자, PB(프라이빗뱅커)를 상대로 진행한 설문조사 결과도 공개했다.
올해 주택매매가격 전망을 묻자 전문가의 95%, 중개업자의 96%, PB의 92%가 ""하락할 것""이라고 답했다.
수도권 중개업자의 35%, 전문가의 26%가 하락 폭으로 '5% 이상'을 예상했고, 비수도권의 경우 ""5% 이상 떨어질 것""이라고 답한 비율(중개업자 36%·전문가 39%)이 수도권보다 높았다.
연구소는 올해 주택가격 하락률을 4.1%로 전망했다.
주택매매가격 반등 시점의 경우 중개업자의 53%, 전문가의 45%, PB의 47%가 2024년을 꼽았다. ""2025년에 반등한다""는 전망의 비율(각 그룹에서 29%, 34%, 40%)은 2024년보다 다소 낮았다.
주택시장 연착륙을 위해 필요한 정책으로는 세 그룹 모두 주택담보대출 규제 완화, 다주택자 양도세 중과 완화, 주택담보대출 정책지원 확대, 생애 최초 주택구매 지원 등을 지목했다.
전문가들은 올해 주택 경기가 좋을 가능성이 큰 지역으로 서울과 경기를, 가장 위축될 지역으로 대구와 인천을 꼽았다. 투자 유망 부동산으로는 재건축(21%), 아파트 분양(21%), 준공 5년 이내 신축 아파트(16%), 재개발(12%) 순으로 거론됐다.
중개업자들은 신축 아파트(16%)·재건축(15%)·아파트 분양(14%)을, PB들은 재건축(22%), 신축 아파트(21%), 아파트 분양(17%)을 차례대로 선호했다.
KB ""당분간 조정 불가피하지만, 급락 가능성 작아""
아울러 연구소는 주택시장 경착륙 가능성을 점검한 결과, 주택가격 조정 국면은 당분간 지속되겠지만 급락으로 이어질 가능성은 작다고 진단했다.
연구소는 ""금융위기 당시 주요국의 LTV(주택담보대출비율)가 70% 이상(미국 최고 100%, 영국 80∼100%, 홍콩 70%대 등)으로 느슨했지만, 한국은 50% 수준을 유지하면서 가계 부실이나 주택보유자 처분 압력으로 이어지지 않았다""고 소개했다.
아울러 ""2019년 주택가격 급등으로 금융 규제가 강화된 뒤 2022년 1분기 국내 가구의 LTV는 평균 38.8%로 낮다. 은행권의 경우 LTV 40% 이하인 가구가 58.4%로 절반 이상이고 70%를 넘는 가구는 1%에 불과하다""며 ""최근 금리 상승과 대출 부담 등이 주택 급매물 증가로 이어지는 악순환이 나타날 가능성은 작다""고 덧붙였다.
연구소는 올해 주택시장 주요 이슈로 ▲ 거래 절벽 지속 여부 ▲ 금리 변동과 영향 ▲ 다주택자 보유세 부담 완화 ▲ 속도 내는 아파트 재건축 ▲ 청약 수요 위축과 미분양 증가 ▲ 월세 부담과 깡통전세·역전세 등을 꼽았다.
""가계대출도 연체율 낮아 금융시스템 위협할 수준 아니다""
연구소는 우리나라 가계대출도 낮은 연체율 등을 고려할 때 금융시스템을 위협할 수준은 아니라고 진단했다.
최근 급증한 가계대출과 빠른 금리 상승으로 향후 2∼3년간 국내 가계대출 연체율이 오를 수 밖에 없지만, 현재 은행권 주택담보대출 연체율이 0.1%대로 역대 최저 수준인만큼 우량 차주 중심의 은행·조합·보험사의 경우 연체율이 현재의 두 배 수준으로 높아지더라도 2015년 수준에 불과하다는 설명이다.
다만 최근 5년간 빠르게 상승한 DSR(총부채원리금상환비율)은 계속 잠재적 연체율 상승 요인이 될 것으로 우려됐다.
국제결제은행(BIS)에 따르면 한국의 DSR은 2016년 10.8%에서 2021년 12.8%로 18.5%나 높아졌다.
shk999@yna.co.kr",2023-03-05 10:11:11,연합뉴스,https://n.news.naver.com/mnews/article/001/0013792668?sid=101,가계부채
부동산 전문가 90% “올해 집값 하락한다”,"부동산 전문가와 중개업소, 자산관리전문가(PB) 10명 중 9명은 올해 집값이 하락할 것으로 내다봤다.
KB금융지주 경영연구소가 5일 발표한 ‘2023년 KB 부동산 보고서’를 보면 전문가의 95%, 중개업자의 96%, PB의 92%가 올해 주택매매가격이 떨어질 것이라고 응답했다. 지난해 중개업소(62%)는 하락을, 전문가(64%)와 PB(52%)는 상승을 예상한 것과 달리 올해는 중개업소·전문가·PB 모두 하락을 전망한 것이다.
이 보고서는 지난해 12월 12일부터 26일까지 건설·시행·학계·금융 등 분야의 부동산 전문가(161명), 중개업소(540명), PB(75명)을 대상으로 진행한 설문조사 결과다.
하락폭에 대해서는 전문가와 PB는 3~5%, 중개업소는 5% 이상 하락을 전망했다. 지역별로는 수도권보다 비수도권의 하락폭 예상치가 더 컸다. 올해 전세시장도 하락세 전망이 우세했는데, 특히 중개업소는 금리상승 여파와 높은 전세가격 부담 등을 이유로 5% 이상 하락을 전망했다.
주택 가격 반등 시기는 전문가·중개업소·PB 모두 내년을 예상한 비율이 가장 높았다. 2026년 이후 반등할 것으로 보는 의견은 소수에 그쳤다. 이르면 내년, 늦어도 2025년에는 주택시장이 회복될 것이라는 전망이 많았다는 의미다. 보고서는 “중개업소는 하락폭이 큰 반면 반등 시기가 빠를 것으로 내다보고, 전문가는 이보다 더 완만한 하락과 상승을 예상하는 것으로 풀이된다”고 설명했다.
다만 건설·시행·금융 전문가의 68%는 올해 분양 물량이 지난해보다 감소할 것으로 예상했다. 국내외 경기 위축으로 인한 분양 리스크 증가(58%)를 예상 이유로 꼽은 이들이 가장 많았다. 주택 매수심리 위축(17%)과 건설비용 상승 등 공급 여건 악화(15%)가 그 뒤를 이었다. 올해 주택 경기가 좋을 가능성이 큰 지역으로 서울과 경기를, 가장 위축될 지역으로 대구와 인천을 꼽았다.
주택경기 침체와 함께 주택가격 하락세가 이어지면서 ‘경착륙’을 우려하는 목소리도 커지고 있다. KB국민은행 조사에 따르면, 지난해 전국 주택매매 가격은 1.8% 떨어졌다. 연간 주택매매 가격이 하락한 것은 2012년 이후 10년만이다. 주택매매가격은 직전 2년간 8~15%의 큰 폭으로 상승했다가 지난해를 기점으로 하락세로 전환됐다.
보고서는 주택가격이 장기간 과도하게 상승한데다, 금리 인상에 따른 부담도 상당한만큼 올해도 주택 가격 조정 국면이 지속될 것으로 봤다. 다만 주택담보대출 부실 위험이 구조적으로 높지 않아 이른바 ‘급매물’이 시장 전반에 확산할 가능성도 낮다고 분석했다.
보고서는 “금융위기 당시 주요국의 주택담보대출비율(LTV) 수준은 70% 이상으로 상대적으로 느슨했으나 한국은 50% 수준을 유지하면서 가계 부실이나 주택 보유자의 처분 압력으로 이어지지 않았다”고 했다.
2019년 주택가격 급등으로 금융규제가 강화된 후 현재 국내 가구의 LTV는 평균 38.7% 수준(2022년 1분기 기준·한국은행 금융안정보고서)을 유지하고 있다.
보고서는 “과거 주택 경기 조정기마다 실제로 문제가 된 것은 가계 부채 등 수요 측면이 아니라 미분양과 건설사 부도 등 공급 측면이었다”며 “주택시장 경착륙에 대한 리스크는 주택가격 하락 뿐 아니라 거래 시장 회복 여부, 미분양 아파트 적체와 영향, 부동산 파이낸싱시장(PF) 등 다양한 요인으로 판단해야 한다”고 지적했다.",2023-03-05 16:34:01,경향신문,https://n.news.naver.com/mnews/article/032/0003208819?sid=101,가계부채
