title,content,published_at,media_name,url,keyword
"[비즈 나우] 금값 '고공행진'…월가 ""더 오른다""","■ 모닝벨 '비즈 나우' - 진행 : 최주연 / 출연 : 임선우
[앵커]
금값이 그야말로 금값인 요즘입니다.
연거푸 최고치를 새로 쓰며 랠리를 이어가고 있는데요.
오죽하면 오늘(5일)이 가장 싸다는 말도 나옵니다.
무슨 이유로 이렇게 오르고, 또 앞으로 전망은 어떨지 임선우 캐스터와 짚어보겠습니다.
계속된 랠리에 차익 매물이 나오며 잠깐 주춤하긴 했지만, 금이 지칠 줄 모르고 오르고 있어요?
[캐스터]
온스당 3천500달러 선을 뚫고 연일 사상 최고치를 갈아치우는 요즘인데, 선물 가격은 3600달러 선까지 돌파했습니다.
올 들어 금값은 35% 가까이 올라 최고의 안전자산으로 떠올랐는데요.
연준의 금리 인하 기대감과 쉽게 잡히지 않는 인플레이션에 대한 우려, 지정학적 불안 등이 복합적으로 작용해 매력을 키우고 있습니다.
국내에서도 투자 열기가 식을 줄 모르고 이어지고 있는데, 8월 말 기준 5대 시중은행의 금 판매액은 이미 지난해 연간 판매액보다 두 배 가까이 늘어난 수준을 보였고요.
실물 금에 투자하는 전통적 수요뿐 아니라, 골드뱅킹에도 뭉칫돈이 몰리면서, 계좌수 는 이달 들어 처음으로 30만 개를 넘어섰고, 잔액도 1조 2천억 원에 육박하고 있습니다.
국내 금 펀드 역시 올해도 연초 이후 평균 약 27%의 두 자릿수 수익률을 기록하면서, 금값 불패라는 말답게, 최근 3년 간 단 한 해도 빠짐없이 상승했고요.
최근 한 달 새 약 1천억 원의 자금이 쏠리는 등 자금도 가파르게 유입되고 있습니다.
[앵커]
왜 이렇게 오르는 건가요?
[캐스터]
금리 인하 기대감이 높아진 데 더해서, 트럼프의 압박 속 연준의 독립성이 훼손되는 것 아니냐는 우려, 여기에 미국의 재정 건전성에 물음표까지 따라붙으면서 안전자산에 대한 수요를 부추기고 있습니다.
특히 금값 고공행진의 가장 큰 동력은 연준의 통화정책 전환 기대감에서 나오고 있는데, 금은 무이자 자산이기 때문에 일반적으로 금리가 낮을수록 투자 매력이 커집니다.
고용시장이 둔화됐다는 지표가 나오면서, 금리 인하에 대한 기대감이 높아지고 있는 가운데, 페드워치에 따르면 연준이 이달 17일 열리는 FOMC에서 기준금리를 인하할 가능성이 90%에 육박한 만큼, 시장은 금리 인하 흐름을 기정사실로 받아들이고 있습니다.
이와 더불어 각국 중앙은행 역시 꾸준히 금 보유고를 늘리는 점도 가격을 떠받치고 있는데요.
올해 전 세계 중앙은행의 금 보유 규모는 1996년 이후 처음으로 미국 국채 보유 규모를 웃돌았습니다.
달러 의존도를 줄이려는 중국과 인도 등 신흥국의 전략적 매수세가 이어진 결과인데, 여기에 관세 이슈까지 현재 법적 허용 여부를 두고 다툼이 번지면서 불확실성을 키우고 있고요.
또 트럼프의 연준 흔들기가 기관의 독립성에 대한 의구심을 키워 달러의 신뢰를 떨어뜨리고, 반사 이익으로 금의 매력을 부각하고 있습니다.
[앵커]
시장에서는 이번 오름세가 단기에 그치지 않고, 추가 상승으로 이어질 것이란 전망이 힘을 얻고 있어요?
[캐스터]
전문가들은 중앙은행부터 연기금, 국부펀드 등 순풍이 한데 모여 다음 상승 모멘텀을 위한 발판을 마련하고 있다며 입을 모으고 있습니다.
UBS는 ""지정학적 불안 외에도, 금리가 내리면 이자가 없는 금을 보유할 때의 기회비용이 줄어들기 때문에 금값이 수혜를 볼 것""이라며, ""중앙은행들도 계속해서 열성적인 매수자로 남을 것""으로 내다보면서, 내년 목표 가격으로 온스당 3천700달러를 제시했고요.
시장 상황이 악화하면 4천 달러까지 오를 가능성도 열어뒀습니다.
웰링턴 매니지먼트 역시 ""지정학적 우려와 연준의 독립성 약화, 중앙은행의 꾸준한 매수 같은 구조적인 순풍 등을 이유로 들며 금에 대해 '비중 확대' 의견을 유지했고요. 골드만삭스는 더 공격적인 전망을 내놨습니다.
연준의 독립성이 무너지면 다시 한번 치솟을 것이란 의견인데요.
이같은 조건에서 금값이 현재보다 40% 이상 오른 온스당 5천 달러까지 상승할 수 있다고 봤는데, 투자자들이 미 국채 보유자산의 1%만 금으로 옮겨도 가격이 폭등할 수 있다고 내다봤습니다.
그러면서 연준의 독립성이 훼손되는 시나리오는 더 높은 인플레이션과 주식, 장기채 가격의 하락, 달러의 기축통화 지위를 약화시킬 것이라며, 반면 금은 제도적 신뢰에 의존하지 않는 가치 저장 수단이라고 주장했습니다.
국가 시스템에 대한 믿음이 흔들릴 때, 금이 대안이 될 수 있다는 뜻으로 해석할 수 있겠죠.
이처럼 극단적인 시나리오 외에도, 기본 전망으로도 내년 중반까지 온스당 4천 달러에 도달할 것으로 예상했고요.
더 나아가 경기침체나, 무역전쟁 격화 등의 '테일리스크' 상황에서는, 연말까지 온스당 4천500달러로 치솟을 수 있다고 내다봤습니다.
흔히 금값은 불안을 먹고 자란다고 하죠.
미국의 금리인하가 임박했다는 관측 속 매력을 높이는 가운데, 미국 경제에 대한 의구심이 미 국채 수요를 줄이면서 활짝 웃는 모습입니다.
[앵커]
임선우 캐스터, 잘 들었습니다.
당신의 제보가 뉴스로 만들어집니다.
SBS Biz는 여러분의 제보를 기다리고 있습니다.
홈페이지 = https://url.kr/9pghjn",2025-09-05 07:49:11,SBS Biz,https://n.news.naver.com/mnews/article/374/0000461410?sid=104,경기침체
"코스피, 보합권 '등락'…고용지표 '대기'","코스피가 보합권에서 등락 중이다.
5일 오전 10시57분 현재 코스피지수는 전거래일대비 0.41포인트(0.01%) 오른 3,201.24를 기록중이다.
이날 밤 발표될 미국의 8월 고용지표 발표를 앞두고 시장에 긴장이 감돌고 있다.
당장의 관심은 고용지표 결과에 대해 시장이 어떤 반응을 내보일지가 관건이다. 고용지표 부진시 미 연준의 기준금리 인하 기대감이 예상되지만 동시에 경기침체 가능성에 대한 우려감도 제기될 수 있는 상황이어서 시장이 예의주시하고 있다.
주요 수급주체별로는 개인이 1,000억원 어치를 사들이고 있다.
반면, 외국인과 기관은 각각 370억원, 810억원 매도 우위.
시가총액 상위종목별로는 대부분이 약세 흐름을 보이고 있는 가운데, 한화오션(-4.96%), LG에너지솔루션(-1.57%), 두산에너빌리티(-1.91%) 등의 낙폭이 눈에 띄고 있다.
SK하이닉스(3.39%), 삼성바이오로직스(0.49%), NAVER(0.55%) 등은 오름세다.
같은 시각 현재 코스닥지수는 전거래일대비 3.28포인트(0.41%) 오른 808.70을 기록중이다.
(사진=연합뉴스)",2025-09-05 11:06:03,한국경제TV,https://n.news.naver.com/mnews/article/215/0001222735?sid=101,경기침체
"국세청 ""체납자 133만 명 전수 조사""","체납액 규모가 매년 증가하면서 정부가 체납자 전수 조사에 나선다. 생계형 체납자에겐 복지 지원책을 마련하고, 상습체납자는 엄정 대응할 방침이다.
국세청은 모든 체납자의 실태확인을 위한 '국세 체납관리단'을 출범한다고 4일 밝혔다.
국세청에 따르면 국세 체납액은 2021년 99조9천억 원에서 지난해에는 110조7천억 원까지 증가했다. 체납자 수도 같은 기간 127만6천 명에서 133만 명으로 늘었다.
경기 침체로 인한 납세 여력 약화, 코로나19 이후 확대된 비대면 행정 등 복합적 요인이 작용한 것으로 국세청은 분석했다.
이에 국세청은 경기도와 성남시의 지방세 체납관리단을 벤치마킹, 납세자를 직접 대면해 실제 경제력을 확인하고 유형별로 대응하는 체납관리단 출범을 추진한다.
체납관리단은 내년 3월 정식 출범해 2028년까지 3년간 모든 체납자(133만 명)를 최소 1회 이상 방문할 계획이다. 방문조사원은 일반 시민을 기간제 근로자로 채용해 주소지와 사업장을 찾아 생활환경과 납부 능력을 확인한다.
기존 체납정리가 압류와 공매 등 징수권 행사 중심이었다면 체납관리단은 사실 확인과 상담, 복지 연계에 집중한다.
체납관리단은 체납자를 생계형, 일시적 납부 곤란자, 고의적 납부 기피자로 나눠 유형별로 조치를 취한다.
생계형 체납자는 긴급복지와 취업지원 등과 연계해 회생을 돕고, 일시적 납부 곤란자는 분납을 유도하고 강제징수를 유예한다.
실제로 시범 운영 과정에서 대전의 소액 체납자 A씨는 사고로 두 눈을 실명해 경제 생활을 하지 못했고, 실태 확인을 통해 긴급복지가 이뤄질 수 있었다.
집중호우 피해를 입은 가구제조 사업주에게는 체납에 따른 해외 출국규제 보류와 매출채권 압류를 유보해 사업을 이어갈 수 있게 했고, 체납액을 분납 중이다.
반면 고의적 납부 기피자는 가택수색, 압류, 사해행위 소송 등 가능한 모든 법적 조치를 동원해 엄정 대응한다.
국세청은 이번 조치를 통해 조세 정의를 강화하는 동시에 복지 사각지대에 있는 생계형 체납자를 지원해 민생 회복에 기여할 수 있을 것으로 기대하고 있다.
특히 청년, 경력단절 여성, 은퇴자를 대상으로 실태확인원 일자리를 제공해 3년간 약 2천 명의 공공일자리 창출 효과도 예상된다.
국세청은 '체납관리 혁신 TF'를 구성하고 관계 부처와의 협의를 통해 법령개정·예산확보·조직신설 등 체납관리단 출범을 준비하고 있다.
안덕수 국세청 징세법무국장은 ""앞으로 고액·상습 체납자는 엄정 대응하고, 세금 납부가 불가능한 생계형 체납자는 지원하는 균형 있는 세정을 통해 따뜻한 기관으로 거듭나겠다""고 말했다.",2025-09-04 14:27:25,한국경제TV,https://n.news.naver.com/mnews/article/215/0001222612?sid=101,경기침체
"8월 민간고용 반토막, 금리인하 '기정사실'…美증시 일제 '랠리'","고용시장 둔화 우려 ↑…금리인하 확률 97.4%
미국 뉴욕증시의 3대 지수가 상승세로 마감했다.
미국 고용 관련 지표들이 둔화한 것으로 집계됐지만 시장은 금리 인하 가능성이 더 커진 것으로 보고 저가 매수에 나선 모습이다.
4일(현지시간) 뉴욕증권거래소(NYSE)에서 다우존스30산업평균지수(다우지수)는 전 거래일보다 0.77% 올라 거래를 마쳤다. 대형주 중심의 S&P500지수는 0.83%, 기술주 중심의 나스닥지수는 0.98% 상승 장을 마감했다.
이날 신규 실업수당 청구 건수와 민간 고용 지표는 모두 예상치를 밑돌아 경기 침체 우려가 나오기도 했지만 투자자들은 경기 침체를 예고할 만큼 부진하지는 않다고 봤다.
민간 고용조사업체 ADP가 이날 발표한 자료에 따르면 8월 민간 고용은 5만4000개 증가했다. 이는 다우존스가 집계한 전문가 예상치 7만5000개에 못 미치고, 7월 수정치 10만6000개 증가에도 크게 못 미쳤다.
함께 발표된 8월 30일로 끝난 주에 신규 청구 건수는 23만7000건으로, 전주보다 8000건 늘었으며 시장 전망치를 웃돌았다. 전날 공개된 7월 구인·이직 조사(JOLTS)에서는 구인 건수가 2020년 이후 최저 수준 중 하나로 나타났다.
해리스파이낸셜그룹의 제이미 콕스 매니징 파트너는 ""ADP데이터는 노동 시장의 긍정적인 변화 속도가 크게 둔화되었다는 것을 강화하고 있다""며 ""연준이 9월에 금리를 인하하기 위해 위험 균형을 기울일 것으로 예상한다""고 밝혔다.
이로써 시장 관심은 5일(현지시간) 발표될 미 노동부 공식 고용보고서에 쏠리고 있다. 이달 16~17일 연방공개시장위원회(FOMC) 회의의 금리 결정에 최대 분수령이 될 수 있기 때문이다.
경제학자들은 8월 비농업 신규 고용이 7만5000개 증가하고, 실업률은 4.2%에서 4.3%로 소폭 높아질 것으로 예상하고 있다. 고용시장 둔화 우려로 이달 말 열리는 연방준비제도(Fed) 회의에서 0.25%포인트의 금리 인하 가능성은 더욱 높아졌다. CME 페드워치에 따르면 9월 금리 인하 확률은 전날 96.6%에서 97.4%까지 치솟았다.
금리인하 가능성 고조로 대형 기술주인 아마존은 4% 이상 급등했다.
(사진=연합뉴스)",2025-09-05 05:07:27,한국경제TV,https://n.news.naver.com/mnews/article/215/0001222672?sid=101,경기침체
"완전자본잠식 새마을금고, 반년새 2배 늘었다","전국 1267개 금고 전수분석
'부동산 경기 악화' 부산·대구 휘청
부실채권 비율 50% 넘는 곳도
무리한 PF대출…경기침체 후폭풍
李대통령 ""관리 사각지대"" 지적
""감독권 이관해야"" 주장 나오지만
금융당국 조직 개편에 힘 빠질 듯
이재명 대통령이 새마을금고의 관리·감독 부실 문제를 지적한 가운데 자기자본이 마이너스 상태인 완전 자본잠식에 빠진 단위 금고만 23곳에 달하는 것으로 파악됐다. 일부 단위 금고는 전체 여신 가운데 회수가 불투명하거나 부실 가능성이 높은 대출 비중이 절반에 육박했다. 금융기관 중 유일하게 금융당국이 아니라 행정안전부 감독을 받는 새마을금고의 부실 위기가 심각한 수준에 이르렀다는 분석이 나온다.
◇대구·부산 새마을금고 ‘비상’
4일 한국경제신문이 한병도 더불어민주당 의원에게서 입수한 ‘전국 새마을금고 1267곳 상반기 실적’ 자료를 분석한 결과 완전 자본잠식에 빠진 단위 금고가 지난 6월 말 기준 23곳에 달했다. 작년 말 14곳에서 6개월 만에 두 배 가까이 급증했다. 완전 자본잠식은 부채가 자산보다 더 커진 심각한 부실 상태로 평가된다.
지역별로 보면 대구 지역의 완전 자본잠식 금고가 8곳으로 가장 많았다. ‘악성 미분양’(준공 후 미분양)이 전국에서 가장 많은 대구 지역의 부동산 경기 침체가 새마을금고 실적에 직격탄으로 이어졌다. 부산 지역의 완전 자본잠식 금고가 5곳으로 뒤를 이었다.
현 법령상 단위 금고는 전체 대출 중 권역 외 대출 비중을 3분의 1 이하로 유지해야 한다. 단위 금고 실적이 지역 경기의 영향을 크게 받는 구조다.
연체율, 고정이하여신(부실채권) 비율 등 건전성이 최악으로 치달은 금고도 수두룩했다. 대구의 A금고와 B금고 고정이하여신 비율은 각각 65.52%, 61.96%에 달했다. 은행권 고정이하여신 비율이 0~1%대인 것을 감안하면 매우 높은 수준이다. 고정이하여신 비율이 20%를 넘은 단위 금고는 총 71곳에 달했다. 그동안 부동산 프로젝트파이낸싱(PF)으로 몸집 키우기에 급급하다가 건설 경기 악화에 따른 부실 후폭풍을 맞고 있다는 분석이 나온다.
◇행안부 감독 역량 ‘도마 위’
권역별 새마을금고의 평균 고정이하여신 비율을 비교하면 전북(15.3%), 부산(13.5%), 경기(12.0%), 대구(11.8%) 순으로 높았다. 반면 강원(6.1%), 충북(7.0%), 제주(7.3%) 등은 상대적으로 건전성이 양호했다. 새마을금고중앙회 관계자는 “강원이나 제주 등은 부동산 PF를 비롯한 기업대출 취급 비중이 작은 지역”이라고 설명했다.
전문가들은 새마을금고의 영업, 내부통제, 관리·감독 등에 이르기까지 근본적인 혁신이 필요하다고 지적했다. 이 대통령도 지난 2일 국무회의에서 “새마을금고가 관리·감독 사각지대”라며 “실제로 지역경제에 도움이 될 수 있도록 운영해야 한다. 말로만 그치지 않게 고쳐야 할 것”이라고 말했다. 한 의원은 “정부·중앙회·개별 금고가 ‘원팀’으로 리스크 관리, 부실채권 매각에 속도를 내 예금자 신뢰를 회복해야 한다”고 했다.
일각에서는 새마을금고 관리·감독이 되레 약화할 수 있다는 우려도 나온다. 정부·여당이 금융위원회를 재정경제부(정책 기능)와 금융감독위원회(감독 기능)로 쪼개는 금융감독체계 개편을 추진하고 있어서다. 금융권 관계자는 “금융위가 새마을금고 관리·감독을 도맡아야 한다는 주장이 많지만, 금융당국 조직 개편이 논의되는 마당에 감독권 이관은 현실적으로 매우 어렵다”고 말했다.",2025-09-04 17:35:14,한국경제,https://n.news.naver.com/mnews/article/015/0005180392?sid=101,경기침체
"기업은행, 소상공인 위기극복 지원 위해 특별지원 실시… 총 7.5조원 규모","[디지털데일리 강기훈 기자] IBK기업은행은 내수회복 지연, 고물가 등으로 어려움을 겪고 있는 소상공인을 위해 총 7.5조원 규모의 특별지원 프로그램(IBK소상공인 더드림 패키지)을 마련한다고 5일 밝혔다.
이번 특별지원 프로그램은 ‘창업지원 부문(2.0조원)’, ‘성장지원 부문(2.5조원)’, ‘경영애로 부문(3.0조원)’ 등 크게 3가지로 구성돼 소상공인별 상황에 따라 맞춤형으로 지원한다.
첫 번째 창업지원 부문의 경우 창업 7년 이내 소상공인을 대상으로 ▲사업장 마련을 위한 시설자금 1.8조원, ▲원자재‧인건비 등 필요 운전자금 0.2조원, ▲맞춤형 컨설팅 등 창업기업 전용 종합 패키지를 올해 7월부터 순차적으로 시행 중이다.
먼저 사업장 마련을 위한 시설자금은 소상공인이 임대료 부담에서 벗어나 안정적으로 사업을 영위할 수 있도록 최초 사업장 구입 시 소요자금의 90% 수준으로 최대 1.5%p까지 금리를 감면한다. 또한 지자체와 협약을 통한 이차보전 연계 시 최대 2.0%p의 금리를 추가로 낮춰 1%대 초저금리로 대출을 받을 수 있다.
설비투자 이후 원자재 구입 및 인건비 지급 등 운전자금이 필요한 소상공인을 위해 기업은행은 신용·기술보증기금과 2천억원 규모의 업무협약을 체결하고 보증료(△0.2~0.5%p) 및 대출금리(최대△1.3%p)를 감면해 창업 소상공인의 금융비용 부담을 최소화시켰다.
이밖에도 생산·재무·경영관리 등 맞춤형 컨설팅을 제공하여 설비투자를 받은 창업 소상공인이 안정적으로 사업을 영위할 수 있도록 적극 지원할 계획이다.
성장지원 부문의 경우 ▲소상공인 가치성장대출 1.5조원(10월), ▲소상공인 스케일up 프로그램 1.0조원(9월말) 등으로 구성돼 우대자금 및 우대금리를 지원할 예정이다.
먼저 소상공인 가치성장대출은 수출, 기술보유, 디지털전환 등 지속적인 성장이 기대되는 소상공인을 대상으로 운전 및 시설자금을 최대 30억원 한도로 지원하고 대출금리는 최대 1.3%p까지 감면한다.
소상공인 스케일up 프로그램은 매출·고용증가, 신규 수출 등을 통해 외형이 확장되고 있는 소상공인에게 1억원 한도의 운전자금을 제공하며 대출금리는 최대 1.5%p까지 감면한다.
경영애로 부문의 경우 ▲소상공인 위기극복지원대출 1.0조원(9월 말), ▲골목상권 소상공인 활력대출 1.0조원(10월), ▲가산금리 상승분 특별감면 프로그램 1.0조원(9월말) 등으로 구성돼 내수회복 지연으로 경영애로를 겪고 있는 소상공인에게 긴급 특별자금을 제공할 예정이다.
소상공인 위기극복지원대출은 매출감소, 원가상승 등을 겪고 있는 경영애로 소상공인을 대상으로 대출한도는 운전자금 최대 1억원, 시설자금 최대 5억원을 제공하며 대출금리는 최대 1.8%p까지 감면한다.
골목상권 소상공인 활력대출은 프랜차이즈 가맹업 또는 디지털 온누리 상품권 가맹점을 영위하는 소상공인을 대상으로 운전자금 최대 5천만원, 대출금리는 최대 1.5%p까지 감면한다.
가산금리 상승분 특별감면 프로그램은 경기침체에 따른 매출 부진 등의 사유로 신용등급이 일시적으로 하락한 소상공인에게 기존 대출 만기 연장 시 신용등급 하락에 따른 가산금리 감면을 지원한다.
한편 기업은행은 지난 1일부터 소상공인의 금융 및 경영애로 해소를 위한 소상공인 전용 상담창구를 전국 563개 영업점에 설치해 운영하고 있다. 이를 통해 소상공인은 대출상담은 물론 채무조정 등의 전반적인 금융상담 및 외부 연계 경영컨설팅까지 제공받을 수 있다.
기업은행 관계자는 “내수부진, 고물가 등 복합위기를 겪는 소상공인의 경영애로 해소 및 성장지원을 위해 프로그램을 마련했다”며 “앞으로도 소상공인 위기극복 지원을 최우선 과제로 설정하고 현장에서 체감할 수 있는 지원방안을 마련할 수 있도록 최선을 다하겠다”고 밝혔다.",2025-09-05 16:28:13,디지털데일리,https://n.news.naver.com/mnews/article/138/0002204247?sid=101,경기침체
