title,content,published_at,media_name,url,keyword
"관세로 되살린다는 미 제조업 6개월째 위축…""금융위기 때보다 나빠""","미국의 제조업 경기가 8월까지 6개월 연속 위축된 것으로 나타났습니다.
도널드 트럼프 대통령은 미국 제조업의 부활을 내걸고 관세 정책을 강행하지만, 산업 현장에선 외려 관세가 제조업을 옥죈다는 불만이 나옵니다.
미국 공급관리협회(ISM)는 8월 제조업 구매관리자지수(PMI)가 전달보다 0.7포인트 상승한 48.7로 집계됐다고 밝혔다고 로이터 통신이 현지시간 2일 보도했습니다.
시장 전망치 49.0을 밑돈 것이자, 6개월 연속 위축 국면이 이어졌습니다.
PMI는 구매관리자들을 상대로 설문조사해 집계하는데 이 수치가 50을 넘기면 경제활동이 확장됐다는 뜻이고, 50 미만이면 위축을 의미합니다.
미국 경제에서 제조업의 비중은 10.2%입니다.
로이터는 공장들이 트럼프 관세의 후폭풍과 씨름하고, 일부 제조업체는 현재 사업 환경이 글로벌 금융위기 때보다 훨씬 나쁘다고 불평하는 가운데 이번 데이터가 나왔다고 지적했습니다.
업종별로 보면 섬유와 1차 금속 등 7개 산업에선 성장이 있었지만, 제지와 기계류, 전기장비, 가전제품, 컴퓨터, 전자제품 등 10개 산업은 경제활동이 쪼그라들었습니다.
제조업체들은 트럼프 대통령의 전방위적 관세로 미국에서 제품을 생산하기가 더 어려워졌다고 불평했다고 로이터는 전했습니다.
일부 운송장비 제조업자들은 금융위기 때보다 상황이 더 나쁘다며 ""100% 관세 정책과 그에 따른 불확실성이 그 원인이다""라고 말했습니다.
일각에선 현 상황이 스태그플레이션(경기 침체 속 물가 상승)과 비슷하다는 평가도 나옵니다.
전기장비와 가전제품 제조업체에서는 많은 부품에 관세를 물리는 바람에 '메이드 인 USA'가 더 힘들어졌다는 불평이 나옵니다.
이들은 정부가 미국에서 제조업 일자리를 원하지만 외려 고숙련·고임금 일자리가 사라지고 있다고 말한다고 로이터는 전했습니다.
컴퓨터와 전자제품 업계는 관세로 사업 계획과 일정 수립 등이 틀어졌다며 원자재 가격 인상으로 생산을 미국으로 되가져오려는 계획에도 차질이 빚어진다고 불만을 표출합니다.
다만 제조업 부문이 모두 암울한 것은 아니어서, 기업들은 인공지능(AI) 제품에 대한 지출을 늘리고 있고, 지식재산권 제품에 대한 지출도 2분기에 4년 만에 가장 큰 폭으로 증가한 것으로 나타났습니다.
#관세 #미국제조업 #침체
연합뉴스TV 기사문의 및 제보 : 카톡/라인 jebo23",2025-09-03 16:07:15,연합뉴스TV,https://n.news.naver.com/mnews/article/422/0000777392?sid=104,경기침체
경기침체의 '그늘'…상반기 8% 줄었다,"올해 상반기 불황 여파에 숙박·음식점, 부동산업이 위축되어 창업 기업이 57만4천여개로 작년 상반기보다 8% 가량 줄었다.
상반기 창업 기업 수가 57만4천401개로 집계됐다고 중소벤처기업부는 28일 내놓은 '2025년 상반기 창업기업 동향'에서 밝혔다.
작년 동기 62만2천760개보다 7.8%(4만8천359개) 줄어든 것이다.
상반기 창업 기업 수는 매년 줄어들고 있다. 지난 2021년 73만260개, 2022년 69만5천891개, 2023년 65만504개, 작년 62만2천760개로 매해 감소 추세다.
올해 상반기 창업 기업 중 숙박·음식점업이 14.7% 감소했고, 부동산업(-12.8%), 도매·소매업(-8.1%) 등 순으로 줄었다.
전반적인 소비 침체에 외식 경기가 나빠진데다, 건설 경기 부진 등이 작용한 것으로 분석됐다.
반면 금융·보험업은 21.9% 늘었다. 전문·과학기술서비스업도 1.7% 증가하는 등 전문 지식 분야 업종은 오히려 창업이 늘어났다.
금융업은 투자 자금이 유입됐고 전문·과학기술서비스업은 온라인 유통 활성화와 디지털전환 확대 등의 영향이었다.
창업은 전 연령대에서 지난해 같은 기간보다 감소했지만 60세 이상 연령대의 창업 감소율은 3.7%에 불과해 30세 미만(-14.0%), 30대(-8.2%), 40대(-7.8%), 50대(-7.7%) 등 다른 연령대에 비해 상대적으로 낮았다.
(사진=연합뉴스)",2025-08-28 06:46:33,한국경제TV,https://n.news.naver.com/mnews/article/215/0001221614?sid=101,경기침체
대책 약빨 한달만에 끝났나…'악성 미분양' 다시 증가,"지방 부동산 경기 침체가 이어지는 가운데 주택을 지어 놓고도 팔리지 않는 ‘악성 미분양’(준공 후 미분양)이 지난달 다시 증가한 것으로 나타났다.
국토교통부가 29일 발표한 7월 주택통계에 따르면 지난 7월 전국의 준공 후 미분양 주택은 2만757가구로 전월 대비 341가구(1.3%) 늘었다. 준공 후 미분양은 2023년 8월부터 올 5월까지 22개월 연속 증가하다 6월 처음으로 감소했으나 한 달 만에 다시 증가로 돌아섰다. 지난해 도입된 정부의 미분양 아파트 매입 확대 정책이 사실상 크게 효과를 내지 못하고 있다는 평가다.
준공 후 미분양의 83.5%(2만2589가구)는 지방 소재 주택으로 집계됐다. 대구가 3707가구로 가장 많았고 이어 경남(3468가구), 경북(3235가구), 부산(2567가구), 경기(2255가구) 등 순이었다. 다만 일반 미분양은 전월보다 2.3%(1490가구) 줄어든 6만2244가구로 6개월 연속 감소세를 이어갔다. 수도권이 1만3283가구로 4.7%(656가구), 지방은 4만8961가구로 1.7%(834가구)가 각각 줄었다.
주택 공급지표인 인허가와 착공 준공 등은 지역별로 엇갈렸다. 수도권은 대체로 1년 전 보다 물량이 늘었지만, 지방은 부진했다. 인허가는 전국 1만6115가구로 작년 같은 기간 대비 26.1% 감소했다. 수도권(9879가구)은 7.3% 늘었지만, 지방(6236가구)이 50.6% 줄었다.
착공은 수도권(1만708가구)이 35.8%, 지방(1만692가구)은 31.4% 늘어 동반 상승했다. 전국 기준 2만1400가구로 작년 대비 33.5% 늘었다.
공동주택 분양(입주자 모집 승인)은 수도권(1만1939가구)이 작년 대비 71.2%, 지방(1만813가구)은 80.0% 각각 늘어 전국적으로는 전국 75.3% 증가한 2만2752가구로 집계됐다.
준공은 전국 2만5561가구로 작년보다 12.0% 감소했다. 수도권(1만5115가구)은 46.5% 늘었고 지방(1만446가구)은 44.2% 줄었다.
매매시장은 6·27대책의 직격탄을 맞은 것으로 나타났다. 지난달 전국 주택 거래량은 6만4235건으로 전월 대비 13.0% 줄었다. 수도권(3만4704건)이 19.2%, 지방(2만9531건)은 4.3% 각각 감소했다.
서울(1만346건)은 15.5% 줄었고, 강북(20.6%↓)의 감소 폭이 강남(10.2%↓)보다 컸다.
전국 아파트 거래(4만9940건)는 전월보다 15.2% 줄어든 것으로 집계됐다. 서울(8485건)이 21.5%, 수도권 전체(2만5696건)는 23.8% 각각 줄었다.
월세화 현상도 지속됐다. 1∼7월 누적 월세 거래량 비중은 2021년 42.3%에서 2022년 51.5%, 2023년 55.0%, 올해에는 61.8%까지 상승했다.",2025-08-29 09:57:15,한국경제,https://n.news.naver.com/mnews/article/015/0005177254?sid=101,경기침체
부동산 경기 침체에 신탁사도 '흔들'…14곳 중 5곳이 '적자',"평균 부채비율 100% 상회
업계 2분기 1343억원 순손실
부동산 경기 침체에 부동산 신탁업계의 재무 건전성도 악화되고 있다. 지난 2분기 부동산신탁사 세 곳 중 한 곳꼴로 적자를 기록했고 업계 평균 부채비율은 100%를 웃돌았다.
25일 금융투자협회 통계에 따르면 국내 부동산신탁사 14개사는 지난 2분기 1195억원 영업손실을 봤다. 순손실 규모는 1343억원이다.
부동산신탁업계는 올해 1분기 영업이익 251억원, 순이익 72억원을 거두며 직전 분기 대비 '찔끔'이나마 흑자 전환에 성공했지만, 2분기 재차 적자로 돌아섰다. 14곳 가운데 5곳이 적자로, 순손실 규모는 우리자산신탁이 762억원으로 가장 컸고, 나머지는 무궁화신탁(447억원), KB부동산신탁(305억원), 교보자산신탁(246억원), 코리아신탁(36억원) 등 순이었다.
부동산신탁사 14곳의 부채비율은 2분기 말 기준 평균 102.6%였다. 업계 평균 부채비율은 1년 전만 해도 68.2% 수준이었으나 올해 1분기 말 92.8%까지 오른 뒤 2분기에 100%를 넘어섰다. 특히 무궁화신탁(319.4%), 한국투자부동산신탁(187.2%), 신한자산신탁(159.8%), KB부동산신탁(152.9%) 등 4곳은 부채비율이 150%를 넘어섰다.
부동산 업황 회복이 더뎌 수입은 줄어드는 반면 부실 사업장에 대한 대응 비용은 지속해서 발생하며 부동산신탁사의 재무건전성을 악화시켰다. 특히 책임준공형(책준형) 토지신탁 사업이 여전히 수익성의 발목을 잡고 있다. 부동산 시장이 활황일 때는 비교적 적은 자기자본으로도 수주를 따낼 수 있어 수익성 효자 노릇을 했지만, 부동산 경기 침체가 장기화하며 각 사업장에 이런저런 문제가 발생하자 '부메랑'이 돼 돌아오고 있다.
상당수 신탁사가 책임준공 의무 미이행으로 대주단으로부터 줄줄이 소송을 당하면서 소송 관련 우발부채 부담이 커졌고, 금융 당국이 재정건전성 강화에 나서면서 영업과 수주 위축 가능성도 높아진 상태다. 실제 부동산금융 익스포저(위험 노출액) 지표인 신탁계정대는 14곳 합산 2분기 말 기준 8조4500억원으로 1년 전(6조600억원)보다 크게 늘었다.
신탁계정대는 사업비를 조달하기 위해 고유계정에서 신탁계정으로 대여한 금액으로, 시공사가 준공 기한을 지키기 어려운 경우 투입되는데 추후 회수하지 못하면 부동산신탁사의 손실로 인식된다. 공사비 상승 등의 리스크가 남아있는 만큼 올해 말까지는 부동산신탁사들의 신탁계정대 투입 부담은 계속될 것으로 보인다.
반면 주 수입원인 토지신탁보수는 2분기 말 1157억원으로 1년 전(1655억원)보다 30%나 감소했다. 여윤기 한국신용평가 수석연구원은 ""토지신탁 시장은 2017년 이전 수준으로 축소된 반면 부동산신탁사 수는 이 기간 11개사에서 14개사로 늘어 경쟁이 더 치열해졌다""며 ""수주 실적도 계속 저조한 상황이라 업계의 수익창출력 회복이 당분간 쉽지 않아 보인다""고 우려했다.",2025-08-25 07:26:13,한국경제,https://n.news.naver.com/mnews/article/015/0005174860?sid=101,경기침체
경기침체에 지자체 소유 토지·건물 임차 소상공인 임대료 80%↓,"올해 한시 적용…행안부, 공유재산정책협의회 개최
(서울=연합뉴스) 차민지 기자 = 정부가 올해 경기 침체로 어려움을 겪는 소상공인·중소기업을 위해 공유재산 임대료율을 한시적으로 기존 5%에서 1%로 낮춘다.
이에 따라 공유재산 임차 소상공인은 임대료 부담을 최대 80%까지 덜 수 있을 전망이다.
행정안전부는 28일 정부세종청사에서 김민재 차관 주재로 '제2차 공유재산정책협의회'를 열고 이같은 내용의 공유재산 및 물품관리법 시행령 개정안에 대해 설명했다고 밝혔다.
개정안은 지난 26일 국무회의에서 의결됐고 내달 2일 공포된다.
공유재산은 지방자치단체가 소유한 토지·건물 등을 뜻하며, 지난해 말 기준 규모는 1천103조원에 달한다. 협의회는 행안부와 지자체, 민간 전문가가 함께 주요 정책 방향을 조율하는 기구다.
이날 회의에서는 공유재산법을 공유재산법, 물품관리법, 공유재산특례제한법 3법 체계로 분법해 관리체계를 정비하고, 인공지능(AI)·지리정보시스템(GIS) 기반의 '공유재산통합관리시스템'을 도입하는 방안도 제시됐다.
김민재 차관은 ""지방소멸과 재정 악화 속에서 공유재산은 단순 보존을 넘어 적극 활용이 필요하다""며 ""지역경제 회복을 위해 중앙과 지방이 머리를 맞대고 최적의 방안을 모색하겠다""고 말했다.
chacha@yna.co.kr",2025-08-28 16:00:01,연합뉴스,https://n.news.naver.com/mnews/article/001/0015592547?sid=102,경기침체
[글로벌 현장을 가다/김철중]국경절 앞두고도 가격 뚝… 금주령-소비 침체 이중고 마오타이주,"부진에 빠진 中 마오타이주 시장
마오쩌둥이 즐겨 마신 中 국주… ‘국경절’ 앞두고도 가격 하락세
5월 내려진 ‘관료 금주령’에 타격… 젊은 소비자 외면에 미래도 불투명
장기 내수 침체의 단면으로도 꼽혀
《지난달 28일 베이징 차오양구의 주류 상점. 중국 전통주인 마오타이의 가격을 묻자 상점 주인은 “한 병에 2000위안(약 40만 원)” 이라고 답했다. 지난해 말에 비하면 소매가가 300위안(약 6만 원)이나 내렸다며 구매를 재촉했다. 다만 마오타이주를 찾는 사람이 많지 않다는 게 느껴졌다. 진열대 가장 위쪽 구석에서 꺼낸 마오타이주 포장 박스에 먼지가 앉아 있었다. ‘판매가 잘 안 되냐’고 묻자 주인은 “지난해 이맘때에 비하면 판매량도 3분의 1로 줄었다”고 푸념했다.》
같은 날 인근의 마오타이 전문점 역시 손님을 찾아보기 어려웠다. 전문점이라 그런지 같은 등급의 마오타이 1병 가격이 1499위안(약 29만3000원)으로 적혀 있었다. 직원에게 해당 가격에 판매 가능하냐고 묻자 “용량이 큰 3799위안(약 74만2500원)짜리 제품을 같이 사야 한다”는 황당한 조건을 제시했다. 다만 이 전문점에서도 직원들은 “(도소매점은) 이전보다 가격이 저렴해진 건 사실이다”라고 말했다.
● 中 최고 명주의 굴욕
중국 전통술인 ‘바이(白)주’ 한 병에 40만 원이라면 턱없이 비싼 가격이라고 할지 모르지만, 마오타이라면 얘기가 다르다. 중국의 국주(國酒)로 불리는 마오타이는 외국 국빈이 중국을 방문하면 연회 테이블에 오르는 고급 술이다. 일반 중국인 가운데 살면서 한 번도 마오타이를 마셔 보지 못한 사람도 적지 않다. 나름 경제적으로 넉넉한 사람들이 중요한 손님을 접대해야 하거나, 결혼식 같은 큰 행사가 있을 때 주로 쓴다.
중국에서 워낙 특별한 술로 통하다 보니 마오타이와 관련된 일화도 많다. 2000년 전 한나라 무황제 시절부터 최고의 술로 인정받았고, 중국공산당 초대 주석인 마오쩌둥(毛澤東)이 즐겨 마셨다고 한다. 1915년 미국 샌프란시스코에서 열렸던 ‘파나마 태평양 국제 박람회’에서 마오타이 술병을 일부러 깨뜨렸고, 박람회 심사위원들이 그 향기에 매료돼 금상을 차지했다는 일화도 유명하다. 1972년 미국 대통령으로는 처음 중국을 방문한 리처드 닉슨 미국 대통령이 저우언라이(周恩來) 당시 총리와 만찬에서 건배한 술도 마오타이였다.
마오타이는 1978년 중국의 개혁개방 이후 급속한 경제 성장 속에 신흥 부자가 급증하면서 수요도 크게 늘었다. 찾는 사람이 많아지면서 2000년대 들어서는 재테크 수단으로도 여겨졌다. 유명 명품 브랜드처럼 일단 사두기만 하면 가격이 올랐기 때문. 특히 특정 연도에만 만들어진 한정판은 구하는 것 자체가 ‘하늘의 별 따기’ 수준이었다. 2022년 중국의 한 온라인 경매에서는 1992년산 마오타이 1병이 3999만 위안(약 78억 원)에 낙찰돼 화제가 됐다.
하지만 마오타이는 최근 가격이 계속 추락하며 명성에 어울리지 않는 수모를 겪고 있다. 중국 온라인 주류 판매 플랫폼인 ‘진르주자(今日酒價)’에 따르면 마오타이의 주력 상품인 53도 페이톈(飛天) 500mL 제품 도매가가 지난달 30일 현재 1795위안(약 35만 원)으로 1800위안대 밑으로 내려갔다. 2019년 한 병에 2700위안(약 52만 원)을 호가하던 시절에 비하면 턱없이 낮은 가격이다. 지난달 6일 도매가는 1875위안(약 36만6200원)으로 약 한 달 만에 4% 또 하락했다. 중국의 양대 명절 중의 하나인 국경절(10월 1일)을 한 달여 앞둔 시점에서 가격 하락은 이례적이라는 게 업계의 설명이다. 고가의 바이주, 특히 마오타이는 명절 선물용으로 많이 구매해 일반적으로 이맘때가 매출이 높은 시기이기 때문이다.
● ‘관료 금주령’에 직격탄 맞아
마오타이 가격은 예년에도 종종 부침이 있었다. 하지만 이번 가격 하락세가 더 길게 이어질 것이라는 분석이 힘을 얻고 있다. 가장 큰 이유는 중국 관료 사회에 내려진 ‘금주령’ 때문이다. 올해 5월 중국 당국은 ‘당정기관의 절약 실시와 낭비 반대 조례’를 발표했다. 조례에는 당정기관에 소속된 공무원들이 업무와 관련해 고급 식사, 담배, 술 등을 제공받지 못하게 하는 내용이 포함됐다. 중앙정부의 강력한 권고에 일부 지방정부와 기관들은 아예 직원들끼리의 식사를 금지시키거나, 업무가 아닌 지인들과의 술자리도 단속하고 있다.
소비심리가 크게 위축됐고, 외식과 주류 업계가 직격탄을 맞았다. 조례 이후 바이주 가격이 전반적으로 하락한 가운데 마오타이가 가장 큰 피해를 봤다. 현지 주류 업계 관계자는 “마오타이는 마시는 용도가 아닌 선물용, 접대용으로 많이 찾기 때문”이라고 설명했다. 수요-공급의 원칙에 의해 가격이 떨어지면 수요가 늘어나는 법이다. 하지만 마오타이는 아무리 맛과 향이 좋아도 직접 마시기엔 비싸고, 정작 접대용으로 쓸 수도 없는 상황에 놓인 것이다.
젊은 층으로부터 외면받고 있다는 점도 매출 하락의 원인 중 하나다. 중국 젊은이들은 바이주 같은 도수가 높은 술을 덜 선호한다. 대신 맥주나 와인, 칵테일처럼 가볍게 즐길 수 있는 술을 선호한다.
고객 확보를 위한 사업 다각화 노력이 없었던 것은 아니다. 2022년 마오타이 아이스크림 매장을 세운 게 대표적이다. 이듬해인 2023년에는 중국 1위 커피업체 ‘루이싱’과 공동으로 술이 들어간 ‘장향 라테’를 출시했다. 하지만 효과가 오래가지 못했다. 장향 라테는 출시 초반에 ‘애국심’ 마케팅에 편승해 하루 수백만 잔이 팔리기도 했지만, 출시 1년여 만에 자취를 감췄다. 마오타이 아이스크림 역시 올해 4월 회사 내의 전담 사업부가 해체됐다.
가격대를 낮춘 제품도 개발했다. 마오타이는 2022년 1000위안(약 20만 원)대 시장을 노리기 위해 ‘마오타이 1935’를 내놨다. 출시 2년 만인 2024년까지 누적 매출이 300억 위안(약 5조8600억 원)을 넘기며 인기를 끌었다. 하지만 이 제품 역시 올해 매출이 크게 줄면서 병당 가격이 공식 출고가(1188위안)보다 낮은 600위안(약 11만7000원)까지 급락했다. 급기야 마오타이 측은 지난 7월 해당 제품의 판매를 중단했고, 새로운 버전을 곧 출시할 예정이다.
● 中 소비시장 침체의 단면
2001년 중국 증시에 상장된 마오타이는 2015년 이후 줄곧 두자릿 수 매출 성장세를 이어 갔다. 이 기간 동안 중국의 부자들과 관료들은 마오타이를 마시며 ‘성공의 기쁨’을 누렸다. 또 마오타이 주가는 중국 경제의 바로미터 역할을 하는 지표 중 하나로도 통했다. 2022년에는 중국 최대 정보기술(IT) 기업 텐센트를 누르고 중국 증시 시가총액 1위를 꿰찼다.
하지만 1일 현재 시총 5위까지 내려앉았고, 주당 가격도 중국 인공지능(AI)칩 설계업체인 캠브리콘 테크놀로지와 1위 자리를 엎치락뒤치락하는 상황이다. 회사 실적도 악화되고 있다. 지난달 발표된 마오타이의 올 상반기 총매출은 전년 동기 대비 9.16% 늘어난 910억9400만 위안(약 17조8000억 원)을 기록했다. 총매출 증가율이 한 자릿수를 기록한 건 2015년 이후 처음이다. 순이익 증가율은 2015년 이후 최저를 기록했다. 로이터통신은 “오랫동안 중국 소비자 수요의 지표로 여겨졌지만, 최근 몇 년 동안 광범위한 디플레이션(경기 침체 속 물가 하락) 압력으로 매출이 침체되고 있다”고 전했다.
7월 중국 소매판매는 작년 동월 대비 3.7% 증가하는 데 그쳤다. 로이터 등 외신들의 예상치(4.6%)보다도 크게 낮았고, 지난해 11월 이후 가장 낮은 증가율을 기록했다. 중국 정부가 내수 회복을 올해 최우선 경제 과제로 삼고, 이구환신(以舊換新·낡은 제품을 새것으로 교체) 보조금 등의 대책을 쏟아냈지만 여전히 회복세가 나타나지 않는 것. 전문가들은 다음 달 열릴 공산당 제20기 중앙위원회 제4차 전체회의(4중전회)에서 대대적인 부양책이 나와야만 내수 회복과 함께 중국이 목표로 한 올해 국내총생산(GDP) 증가율 5%를 유지할 것으로 전망했다.",2025-09-02 23:10:17,동아일보,https://n.news.naver.com/mnews/article/020/0003658301?sid=110,경기침체
4대 시중은행 '깡통대출' 4조원 넘었다,"이자 못내는 중기·소상공인 늘어
건설업·도소매업 연체율 '비상'
전담조직 신설 등 부실 관리 총력
국민 신한 하나 우리 등 4대 은행의 무수익여신 잔액이 처음으로 4조원을 넘어선 것으로 나타났다. 무수익여신은 이자 상환조차 이뤄지지 않아 이른바 ‘깡통대출’로 불리는 악성 채무를 의미한다. 경기 침체로 빚을 갚지 못한 소상공인과 중소기업 등이 급증한 여파로 풀이된다.
25일 4대 은행이 공시한 올해 반기보고서에 따르면 이들 은행의 무수익여신 잔액은 지난 6월 말 기준 4조1026억원이었다. 지난해 말(3조1899억원) 대비 28.6% 증가했다. 4대 은행 무수익여신 잔액이 4조원을 넘어선 것은 이번이 처음이다.
반면 4대 은행 총여신 잔액은 같은 기간 1459조2000억원에서 1468조3000억원으로 0.6% 늘어나는 데 그쳤다. 무수익여신 증가 속도가 전체 대출자산과 비교해 더 가파르다는 뜻이다. 총여신에서 무수익여신이 차지하는 비율도 0.22%에서 0.28%로 높아졌다.
가계대출보다 기업대출 부실이 더 심각했다. 기업 무수익여신 잔액은 지난해 말 2조1465억원에서 올해 6월 말 2조8288억원으로 31.8% 급증했다. 가계 무수익여신 잔액은 같은 기간 1조321억원에서 1조2628억원으로 22.4% 늘어났다.
일반적으로 은행은 90일 이상 원금을 못 갚고 이자도 상환하지 못한 대출을 무수익여신으로 분류한다. 은행권에서는 고정이하여신(부실채권)보다 손실 우려가 큰 악성 채권으로 본다.
경기 침체 장기화로 건설업, 도소매업 등에 종사하는 소상공인과 중소기업의 대출 부실이 가속화하고 있다는 게 은행권의 설명이다. 금융감독원에 따르면 4대 은행의 건설업 연체율(산술 평균 기준)은 2분기 말 기준 0.79%로 집계됐다. 관련 통계 집계를 시작한 2018년 1분기 이후 가장 높은 수준이다. 도소매업 연체율도 지난해 말 0.52%에서 올 2분기 말 0.63%로 뛰었다.
대출 부실 확대에 따라 은행들의 고민도 깊어지고 있다. 우리은행은 이달 들어 소상공인 연체율 관리 등을 위한 채무조정 전담 조직을 신설했다. 국민은행과 하나은행은 자산건전성 관리 태스크포스팀(TFT)과 연체 대출 관리 TFT를 통해 부실 위험 차주의 모니터링을 강화했다. 신한은행은 대출 부실 확대에 대비한 선제적 관리에 집중하겠다는 방침이다.",2025-08-25 17:02:17,한국경제,https://n.news.naver.com/mnews/article/015/0005175203?sid=101,경기침체
